id,text,y,url,source,published_at,symbols,industries
f515b595-8eb2-4c8f-9b0b-cacfbdd1b15b,Jim Cramer says investors shouldn't chase Monday's market rally — here's why — The move up in stocks is too indiscriminate and likely neglecting real risks.,,https://www.cnbc.com/2025/05/12/jim-cramer-says-investors-shouldnt-chase-mondays-market-rally-.html,cnbc.com,2025-05-12T17:39:43.000000Z,"AAPL, NVDA, BBY, SWK","Technology, Consumer Cyclical, Industrials"
46775ee6-7823-4c6a-9771-514f64f1e3ef,"Why Nvidia, Broadcom, and Other Semiconductor and AI Stocks Rallied Monday Morning — Investors got some good news that gave them hope for the future.",,https://finance.yahoo.com/news/why-nvidia-broadcom-other-semiconductor-164925002.html,finance.yahoo.com,2025-05-12T16:49:25.000000Z,"AMD, AVGO, AVGOP, NVDA",Technology
a44b4363-bb84-4dfb-aeaf-1c42bf827bde,"Top Stock Movers Now: Apple, NRG Energy, Newmont, and More — U.S. equities soared at midday following this weekend's agreement between the U.S. and China to lower tariffs for 90 days.",,https://www.investopedia.com/top-stock-movers-now-apple-nrg-energy-newmont-and-more-11732963,investopedia.com,2025-05-12T15:58:11.000000Z,"AAPL, NVDA, TSLA","Technology, Consumer Cyclical"
0cba851e-eefc-40fb-9057-312e64a6b73f,Comparative Study: NVIDIA And Industry Competitors In Semiconductors & Semiconductor Equipment Industry - NVIDIA (NASDAQ:NVDA),,https://www.benzinga.com/insights/news/25/05/45352063/comparative-study-nvidia-and-industry-competitors-in-semiconductors-amp-semiconductor-equipment-ind,benzinga.com,2025-05-12T15:00:24.000000Z,"0YXG.L, 0L77.L, 0R06.L, AMD, ADI, AVGO, AVGOP, NVDA, FSLR, MU, SWKS, QRVO, MPWR, ASX, AVGO34.SA, FSLR34.SA, MUTC34.SA, A1MD34.SA, Q1RV34.SA, NVDA.MI, 3711.TW, NVDAD.BA, QCOMD.BA, FSLR.BA, QCOMC.BA, NVDAC.BA, AVGO.BA, AVGOD.BA, ADI.BA, ADID.BA, AMD.DE, MTE.DE, F3A.DE, ANL.DE, 2QO.DE, 1YD.DE, AWM.DE, AMD.MX, MU.MX, FSLR.MX, SWKS.MX, AVGO.MX, ADI.MX, ASEHN.MX, MPWR.MX, 0HFN.L, 0KSJ.L",Technology
8aa1c4f5-7593-46f2-a0b8-e6ae826dd6d8,"Here’s Why NVIDIA Corporation (NVDA) Fell in Q1 — Baron Funds, an investment management company, released its “Baron Technology Fund” first quarter 2025 investor letter. A copy of the letter can be downloaded here.",,https://www.insidermonkey.com/blog/heres-why-nvidia-corporation-nvda-fell-in-q1-2-1531083/,insidermonkey.com,2025-05-12T13:12:18.000000Z,"NVDA, NVDA.BA, NVD.DE, NVDA.MX, NVDC34.SA",Technology
fb1eb992-c2a4-415d-9632-7b9f360aa4ee,"Stocks, Yields, Dollar Soar On US-China Trade War Truce — ZeroHedge - On a long enough timeline, the survival rate for everyone drops to zero",,https://www.zerohedge.com/market-recaps/stocks-yields-dollar-soar-us-china-trade-war-truce,zerohedge.com,2025-05-12T12:25:41.000000Z,"MSCL.SN, MDB, ^N225, USDCNY, USDJPY, EURUSD, AAPL, AMD, AZN, GOOGL, ACIW, NVDA, MSFT, TSLA, NVO, ZEG.DE, NOVC.DE, NOVA.DE, ^FCHI, AZNN.MX, NVON.MX, RHHBY, AZNCF, RHHBF, ROGN.MX, NONOF, RHHVF, NOVOBN.MX, AZN.L, 0TDF.L, 0TDD.L, 0A4J.L, 0QQ6.L, ^AXJO, ROG.SW, RO.SW, MSFT.MI, NVDA.MI, ^NSEI","Technology, Healthcare, Communication Services, Consumer Cyclical"
610c2650-c0e0-4e83-8424-b74f05ce808a,"Wall Street Futures jump as US-China tariff deal lifts global sentiment — International Business News: US stock index futures surged following an agreement between the United States and China to scale back tariffs, easing trade war anxieties. The 90-day",,https://timesofindia.indiatimes.com/business/international-business/us-stock-market-today-wall-street-futures-jump-as-us-china-tariff-deal-lifts-global-sentiment/articleshow/121109803.cms,timesofindia.indiatimes.com,2025-05-12T11:37:22.000000Z,"AMD, NVDA, MRVL, TSLA, JNJ, DJNJ2.BA, DJNJ3.BA, ^J202.JO","Technology, Consumer Cyclical, Healthcare"
04b7174b-323a-4663-a621-0c32b18a1596,"Les actions et le dollar bondissent après la baisse des tarifs douaniers entre les États-Unis et la Chine — Les contrats à terme sur les actions américaines et les actions des groupes logistiques européens sont en forte hausse, tandis que le secteur pharmaceutique...",,https://www.morningstar.fr/fr/news/264773/les-actions-et-le-dollar-bondissent-après-la-baisse-des-tarifs-douaniers-entre-les-états-unis-et-la-chine.aspx,morningstar.fr,2025-05-12T09:30:15.000000Z,"AAPL, NVDA, TSLA","Technology, Consumer Cyclical"
8ec8e299-fb89-4b58-b0bb-a059fb3d2afb,"Stocks, Dollar Surge After US and China Slash Tariffs — US equity futures, European logistics stocks rise sharply while pharma sector declines on Trump’s drug pricing plans.",,https://www.morningstar.co.uk/uk/news/264771/stocks-dollar-surge-after-us-and-china-slash-tariffs.aspx,morningstar.co.uk,2025-05-12T09:18:21.000000Z,"AAPL, NVDA, TSLA","Technology, Consumer Cyclical"
9a62699b-5f35-4bc5-bf9a-20a4e8ecb4fb,"Bonds, Equities, and Indexes Under the Tariff Lens: What Holds Up Best? — Market Analysis by  covering: FTSE 100, S&P 500, General Motors Company, Microsoft Corporation. Read 's Market Analysis on Investing.com",,https://www.investing.com/analysis/outlook-of-index-funds-bonds-and-equities-as-a-result-of-tariffs-200660623,investing.com,2025-05-12T03:23:00.000000Z,"NVDA, MSFT, ON, GM, PGRE, QQQ","Technology, Consumer Cyclical, Real Estate"
66bf2b1c-96de-41ec-9b80-08f0a49a1d91,The Latest Thoughts From American Technology Companies On AI (2025 Q1) : The Good Investors % — The Good Investors The Latest Thoughts From American Technology Companies On AI (2025 Q1) Special Events :,,https://www.thegoodinvestors.sg/the-latest-thoughts-from-american-technology-companies-on-ai-2025-q1/,thegoodinvestors.sg,2025-05-11T23:34:00.000000Z,"CPNG, FRGAP, AAPL, GOOG, GOOGL, META, NVDA, MSFT, DDOG, DSPG, SUMO, EGOV, ABNB, ANET, MSFT.MI, NVDA.MI, AAPL.NE","Consumer Cyclical, Technology, Communication Services"
e675b2d9-f34d-4734-86b2-9ef6ee3a3d45,"The Best Stocks to Invest $1,000 in Right Now — Major benchmarks are down this year amid concerns about import tariffs and their impact on economic growth.  The stock market may not seem like the friendliest place for investors right now, with the three major benchmarks -- the S&P 500, the Dow Jones Industrial Average, and the Nasdaq Composite -- down since the start of the year.  Worries about President Donald Trump's plan to impose tariffs on imports have halted the positive momentum that carried indexes over the past two years.",,https://finance.yahoo.com/news/best-stocks-invest-1-000-221000202.html,finance.yahoo.com,2025-05-11T22:10:00.000000Z,NVDA,Technology
71a3b6f4-32c6-461e-9794-b6e03e7bdadf,"NVIDIA Corporation (NVDA): Among the Best Stocks to Buy According to Jim Simons’ Renaissance Technologies — We recently published a list of 15 Best Stocks to Buy According to Jim Simons’ Renaissance Technologies In this article, we are going to take a look at where NVIDIA Corporation (NASDAQ:NVDA) stands ...",,https://www.insidermonkey.com/blog/nvidia-corporation-nvda-among-the-best-stocks-to-buy-according-to-jim-simons-renaissance-technologies-1530688/,insidermonkey.com,2025-05-11T20:49:18.000000Z,"NVDA.BA, NVDA, NVD.DE, NVDA.MX, NVDC34.SA",Technology
8f029b2a-4889-4563-b198-c1a5ea1b8857,"Here are the 3 things we're watching in the stock market in the week ahead — The economic data calendar is jam-packed, and trade headlines will dominate too.",,https://www.cnbc.com/2025/05/11/here-are-the-3-things-were-watching-in-the-stock-market-in-the-week-ahead.html,cnbc.com,2025-05-11T17:22:23.000000Z,"AMAT, JACK, NVDA, CSCO, CSIQ, FOX, FOXA, JD, TXRH, LSTR, BALY, SE, DED.BA, PLUG, SEN.MX, 0A3T.L, FOXC34.SA, S2EA34.SA","Technology, Consumer Cyclical, Communication Services, Industrials"
edc3181d-d728-416d-9c7a-35a3a6fa81ce,"Nvidia: HOLD, Despite Market Cap Of Chip-Makers Likely To Double (NASDAQ:NVDA) — I have spent two years studying AI and semiconductor stocks, which are early beneficiaries of the AI trend, complicating fair value assessments.",,https://seekingalpha.com/article/4785301-nvidia-hold-despite-market-cap-of-chip-makers-likely-to-double,seekingalpha.com,2025-05-11T13:27:44.000000Z,NVDA,Technology
3c0611bf-21e4-4b34-998c-424f6a591dfa,"AI Threatens To Disrupt Search Giants, Nvidia Rival AMD's Market Position Strongest Ever And More: This Week In Artificial Intelligence - Apple (NASDAQ:AAPL), Advanced Micro Devices (NASDAQ:AMD) — As the weekend wraps up, we reflect on a week filled with intriguing developments in the tech and finance world. From the potential disruption of search engine giants to the call for AI education by leading CEOs, the week was anything but dull. Let's dive into the top stories that made headlines.",,https://www.benzinga.com/markets/equities/25/05/45337402/ai-threatens-to-disrupt-search-giants-nvidia-rival-amds-market-position-strongest-ever-and-more-,benzinga.com,2025-05-11T12:00:23.000000Z,"PLTR, AAPL.MX, AMD.MX, GOOGL.MX, GOOG.MX, 0A7R.L, AAPL, AMD, GOOG, GOOGL, SMCI, A1MD34.SA, NVDA.MI, AAPL.BA, GOOGL.BA, NVDAD.BA, AAPLD.BA, NVDAC.BA, GOGLD.BA, AAPLC.BA, GOOGL.SN, AAPLCL.SN, AAPL.SN, GOOG.SN, GOOGCL.SN, AAPL.NE, APC.DE, AMD.DE, ABEA.DE, ABEC.DE, PTX.DE","Technology, Communication Services"
a324e536-c5a5-4b30-bd7d-6bbe86548b5a,"Is Intel Stock a Buy Right Now? — Intel is in rare company, as it is one of the better-known chip stocks that has failed to win over investors throughout the AI revolution.",,https://finance.yahoo.com/news/intel-stock-buy-now-214500113.html,finance.yahoo.com,2025-05-10T21:45:00.000000Z,"AMD, AVGO, AVGOP, NVDA, INTC",Technology
32bf8355-5fed-4ee6-bf7c-7eb507b53c68,"Nvidia Stock At 40% Safety — With artificial intelligence tunes playing everywhere, do you think Nvidia stock is a good long-term bet at current levels?",,https://www.forbes.com/sites/greatspeculations/2025/05/10/nvidia-stock-at-40-safety/,forbes.com,2025-05-10T14:57:37.000000Z,NVDA,Technology
f635e445-d673-40db-b4a4-43c8a1ac38c9,"Benzinga Bulls And Bears: IBM, Novavax, Arm Holdings — And UK Trade Deal Boosts Markets Benzinga Bulls And Bears: IBM, Novavax, Arm Holdings — And UK Trade Deal Boosts Markets — Benzinga examined the prospects for many investors' favorite stocks over the last week — here's a look at some of our top stories.",,https://www.benzinga.com/25/05/45335181/benzinga-bulls-and-bears-ibm-novavax-arm-holdings-and-uk-trade-deal-boosts-markets,benzinga.com,2025-05-10T12:08:23.000000Z,"AVGO, AVGOP, NVDA, SMCI, NVAX, RUN, SRPT, IBM, HIMS, HIMS-WT, NVAX.MX, 0A3S.L, 0L35.L, BTCUSD, NVDA.MI, NVDAD.BA, NVDAC.BA","Technology, Healthcare, Consumer Defensive"
6a1897cc-8ca2-47e3-87ba-26af09d4eedc,"Google, Nvidia among Wedbush's top 30 tech names defining the future of AI — Wedbush has selected 30 tech names, including Apple (AAPL), Nvidia (NVDA) and Alibaba (BABA), that it believes would define the future of the AI theme.",,https://seekingalpha.com/news/4444571-google-nvidia-among-wedbushs-top-30-tech-names-defining-the-future-of-ai,seekingalpha.com,2025-05-10T12:00:17.000000Z,"AAPL, BIDU, NVDA","Technology, Communication Services"
1c739d76-be7c-47f5-b78c-af0fd7db80fa,"Big Tech’s Q1 Blowout Can’t Hide Bubble-Level Valuations — Market Analysis by  covering: S&P 500, Chevron Corp, Microsoft Corporation, Coca-Cola Co. Read 's Market Analysis on Investing.com",,https://www.investing.com/analysis/big-techs-q1-blowout-cant-hide-bubblelevel-valuations-200660613,investing.com,2025-05-09T19:31:00.000000Z,"AAPL, GOOGL, NVDA, MSFT, BRK-B, BRK-A, CVX, ORCL, SPXC, MSFT.MI, NVDA.MI, BRKB.BA, BRKBD.BA, BRKBB.BA","Technology, Communication Services, Financial Services, Energy, Industrials"
2ef2ee11-5bb8-4611-99e3-e4034fd9be57,Was Jim Cramer Right About Intel Corporation (INTC)? — We recently published a list of Jim Cramer Nailed These 12 Stock Predictions.,,https://www.insidermonkey.com/blog/was-jim-cramer-right-about-intel-corporation-intc-1529844/,insidermonkey.com,2025-05-09T19:13:44.000000Z,"INL.DE, INTC, INTC.MX, INCO.BR, INTC.SN",Technology
f775c38c-261d-4190-a8aa-fcdfbe5730f8,"Stock Market Recap: Markets Edge Higher on Trade Talk Optimism — Based on the information I've gathered, I'll now write the market recap article for Friday, May 9, 2025.",,https://thestockmarketwatch.com/stock-market-news/stock-market-recap-markets-edge-higher-on-trade-talk-optimism/49431/,thestockmarketwatch.com,2025-05-09T18:01:45.000000Z,"AAPL, GOOGL, NVDA, MSFT, TSLA","Technology, Communication Services, Consumer Cyclical"
60393738-ac46-4617-8a87-a4340eaf634b,"AMD Upgraded to Hold by Analysts Amidst Revenue Concerns — Summary:
    Advanced Micro Devices (AMD) received a recommendation upgrade to",,https://www.gurufocus.com/news/2850436/amd-upgraded-to-hold-by-analysts-amidst-revenue-concerns,gurufocus.com,2025-05-09T17:56:24.000000Z,"AMD, AMD.DE, AMD.MX, A1MD34.SA",Technology
363253c2-06b9-42bb-8650-7dee397a7b7a,"Why Texas Roadhouse Stock Was Heating Up Today — Texas Roadhouse delivered solid comparable-sales growth in the first quarter, and said traffic accelerated into Q2.  Shares of Texas Roadhouse (NASDAQ: TXRH) were moving higher today after the fast-casual restaurant chain delivered solid results in its first-quarter earnings report.  The steakhouse chain, which has long been an outperformer on the stock market, said that comparable sales in the quarter were up 3.5%, driving overall revenue up 9.6% to $1.45 billion, which was slightly ahead of estimates at $1.44 billion.",,https://finance.yahoo.com/news/why-texas-roadhouse-stock-heating-164804996.html,finance.yahoo.com,2025-05-09T16:48:04.000000Z,"NVDA, NFLX, TXRH","Technology, Communication Services, Consumer Cyclical"
41cfdcfa-58b8-4366-90d8-acc2efe49825,"Intel Stock: Too Slow, Too Late (NASDAQ:INTC) — Intel's weak Q1 results and rising macro risks signal challenges ahead. Click here to find out why INTC stock is a Sell.",,https://seekingalpha.com/article/4784139-intel-too-slow-too-late,seekingalpha.com,2025-05-09T13:45:00.000000Z,INTC,Technology
5a5969cc-0ae0-4aa4-9080-3ec8a0579b4f,"Futures Gain Ahead Of US-China Trade Talks — ZeroHedge - On a long enough timeline, the survival rate for everyone drops to zero",,https://www.zerohedge.com/markets/futures-gain-ahead-us-china-trade-talks,zerohedge.com,2025-05-09T12:32:29.000000Z,"MSCL.SN, IOVA, ^N225, AAPL, GOOGL, NVDA, MSFT, EXPE, GOGO, TSLA, LYFT, AFRM, USDJPY, EURUSD, EURGBP, FIGS, ^FCHI, MQG.AX, MQGPD.AX, MQGPC.AX, ^AXJO, MQGPE.AX, MSFT.MI, NVDA.MI, CBK.MI","Healthcare, Technology, Communication Services, Consumer Cyclical, Financial Services"
3c90de18-a5d4-4373-ba15-cf7d62661c43,"Palantir Cracks the Top 10: Now One of the Most Valuable U.S. Tech Giants — Palantir Technologies Inc. (PLTR) joined the top 10 U.S. tech companies with a $281 billion market cap after an 8% stock surge, surpassing Salesforce.com Inc. (CRM) at $268 billion, while Microsoft Corporation (MSFT) leads at $3.3 trillion. The company’s 58% stock gain in 2025, driven by a 45% government business…",,https://wallstreetpit.com/126696-palantir-cracks-the-top-10-now-one-of-the-most-valuable-u-s-tech-giants/,wallstreetpit.com,2025-05-09T12:23:47.000000Z,"AAPL.MX, MSFT.MX, NVDA.MX, CSCO.MX, TSLA.MX, CRM.MX, IBM.MX, AVGO.MX, IBM.L, 0YXG.L, 0A7R.L, AAPL, AVGO, AVGOP, NVDA, MSFT, CSCO, TSLA, IBM, PLTR, CRM, MSF.BR, CIS.BR, 4333.HK, AVGO34.SA, NVDC34.SA, TSLA34.SA, SSFO34.SA, IBMB34.SA, AAPL.BA, NVDA.BA, CRM.BA, TSLAD.BA, AAPLD.BA, TSLAC.BA, AVGO.BA, AVGOD.BA, CRMD.BA, AAPLC.BA, MSFT.SN, AAPLCL.SN, AAPL.SN, AAPL.NE, APC.DE, IBM.DE, NVD.DE, CIS.DE, TL0.DE, MSF.DE, FOO.DE, 1YD.DE, PTX.DE","Technology, Consumer Cyclical"
bc652444-5451-4a73-b9a8-e850f863aea7,"Market Today: Lyft Expands Share Buyback, Trade Desk Surges, Meta Explores Stablecoins — The stock market experienced a positive day with all major indices closing higher. Gains ranged between 0.6% and 1.1%, driven by encouraging trade developments",,https://www.gurufocus.com/news/2846519/market-today-lyft-expands-share-buyback-trade-desk-surges-meta-explores-stablecoins,gurufocus.com,2025-05-08T22:32:23.000000Z,"TTD, NVDA, CASH, LYFT","Technology, Financial Services"
e9333005-3228-4089-87bb-908dbd96c81b,Nvidia Stock Is Down 21% From Its Peak. Is It Time To Buy? (NASDAQ:NVDA) — Nvidia is down nearly 21% from its peak ahead of its latest earnings results. Click to find out if it is it time to buy the NVDA dip?,,https://seekingalpha.com/article/4783852-nvidia-stock-is-down-21-percent-from-its-peak-is-it-time-to-buy,seekingalpha.com,2025-05-08T21:00:56.000000Z,"NVDA, MSCL.SN",Technology
c5bc6c0d-68a5-4b52-8fd8-2c1ca802d2c0,"Palantir now among 10 most valuable U.S. tech companies — its earnings multiple is astronomical — After Palantir's stock surge, investors now have to pay over 520 times earnings to buy it.",,https://www.cnbc.com/2025/05/08/palantir-joins-top-10-most-valuable-tech-companies-stock-at-premium.html,cnbc.com,2025-05-08T20:17:29.000000Z,"AAPL, GOOGL, AVGO, AVGOP, NVDA, MSFT, TSLA","Technology, Communication Services, Consumer Cyclical"
58e43569-268c-4cb6-9fdb-e3772ab51a15,"Market Surge: US Stocks Rally on UK Trade Deal and Tech Sector Gains — US stock markets rallied significantly on Thursday, May 8, 2025, as investors celebrated a newly announced trade agreement between the United States and the",,https://thestockmarketwatch.com/stock-market-news/market-surge-us-stocks-rally-on-uk-trade-deal-and-tech-sector-gains-may-8-2025/49424/,thestockmarketwatch.com,2025-05-08T18:28:44.000000Z,"NVDA, MSFT, INTC, ON, TSLA, MU, NVD.DE, INL.DE, INTC.MX, NVDA.MX, INCO.BR, NVDC34.SA, NVDA.BA, INTC.SN","Technology, Consumer Cyclical"
4e6353b3-b0d5-4fb1-8cc5-03ce4ff63212,"Dow Pops To 5-Week High And Bitcoin Tops $100,000 As Trump Stokes Rally — “You better go out and buy stock now,” Trump said Thursday.",,https://www.forbes.com/sites/dereksaul/2025/05/08/stocks-rip-to-6-week-high-and-bitcoin-prices-top-100000-as-trump-stokes-rally/,forbes.com,2025-05-08T16:21:00.000000Z,"AAPL, GOOGL, NVDA, MSFT, TSLA","Technology, Communication Services, Consumer Cyclical"
ab06f757-9d5f-4269-9db2-41602795f670,Billionaire Chris Rokos’ 10 Stock Picks with Huge Upside Potential — One of the traits that define investors who become billionaires is the ability to make money regardless of market conditions. Chris Rokos is one example.,,https://www.insidermonkey.com/blog/billionaire-chris-rokos-10-stock-picks-with-huge-upside-potential-1527522/,insidermonkey.com,2025-05-08T15:50:08.000000Z,"NVDA, ON, ONTO, NVDA.BA, NVD.DE, NVDA.MX, NVDC34.SA",Technology
1a334cb3-eaf3-4622-9216-caede5f62c0b,"Cathie Wood Goes Bargain Hunting: 3 Stocks She Just Bought — In a rising market, the iconic growth investor is adding to positions trading well below their earlier highs.",,https://finance.yahoo.com/news/cathie-wood-goes-bargain-hunting-152200064.html,finance.yahoo.com,2025-05-08T15:22:00.000000Z,"AMD, NVDA",Technology
a3761e4c-5a4e-4e41-8fe2-a8237f4391ae,"U.S. Stocks May See Initial Strength On News Of U.S.-U.K. Trade Deal — The major U.S. index futures are currently pointing to a higher open on Thursday, with stocks likely to see further upside after ending yesterday's volatile session mostly higher.",,https://www.rttnews.com/story.aspx?Id=3537290,rttnews.com,2025-05-08T12:55:41.000000Z,"NVDA, ^AXJO, TCL.AX, ^HSI, NZX.NZ, NZ50C.NZ, TRAUF, SGLFF, ^N225, SGL.DE, ^FCHI","Technology, Industrials, Financial Services, Basic Materials"
23990986-c7a0-4a07-aa60-482893f0090b,"5 Stocks That Crushed Earnings and Guidance Forecasts — Market Analysis by  covering: Microsoft Corporation, Advanced Micro Devices Inc, Netflix Inc, Meta Platforms Inc. Read 's Market Analysis on Investing.com",,https://www.investing.com/analysis/5-stocks-that-crushed-earnings-and-guidance-forecasts-200660545,investing.com,2025-05-08T12:48:00.000000Z,"AMD, MSFT, NFLX, RBLX","Technology, Communication Services"
f853ce76-aeaf-4a86-b764-851c5574907c,"Futures, Global Markets Jump On Trump Trade Deal With UK — ZeroHedge - On a long enough timeline, the survival rate for everyone drops to zero",,https://www.zerohedge.com/markets/futures-global-markets-jump-trump-trade-deal-uk,zerohedge.com,2025-05-08T12:24:00.000000Z,"^FCHI, AAPL, GOOGL, NVDA, MSFT, FTNT, TSLA, PTON, MELI, MGNI, APP, SHOP, TPR, PTON.MX, SHOPN.MX, MGNI.MX, TPR.MX, 0LD5.L, YI, 0VHA.L, ^AXJO, TPRY34.SA, S2HO34.SA, ^NSEI, TMD.BA, SHOP.BA, SHOPD.BA, MSCL.SN, ^N225, USDCNY, USDJPY, EURUSD, EURSEK, SHOP.TO","Technology, Communication Services, Consumer Cyclical, Healthcare"
2d1e9486-5b8a-468d-8aac-963b308223df,The BOE cuts by 25 basis points but it is a mixed decision. USDJPY higher. EURUSD lower. — The GBPUSD bounces after the cut,,https://www.forexlive.com/technical-analysis/the-boe-cuts-by-25-basis-points-but-it-is-a-mixed-decision-usdjpy-higher-eurusd-lower-20250508/,forexlive.com,2025-05-08T12:12:20.000000Z,"AVGO, AVGOP, NVDA",Technology
7125e796-8abf-4fa0-9fec-6b8b8a4a82c6,"5 Things to Know Before the Stock Market Opens — U.S. stock futures jump after President Donald Trump announces the U.S. has reached a trade deal with the U.K., and Google parent Alphabet's stock rebounds after sharp losses yesterday on worries that its search business is threatened by AI. Here's what investors need to know today.",,https://www.investopedia.com/5-things-to-know-before-the-stock-market-opens-may-08-2025-11730596,investopedia.com,2025-05-08T12:01:14.000000Z,"AAPL, AMD, GOOGL, AVGO, AVGOP, NVDA, APP","Technology, Communication Services"
c44f8572-3277-4020-b3cf-c0d905d9aa0c,"Asia shares firm on hopes for US trade deals — Shares in Asia firmed on Thursday after US President Donald Trump flagged a first trade deal in his global tariff war, while the dollar tried to hold overnight gains as markets pushed out the chance of near-term rate cuts. S&P 500 futures erased earlier losses to be up 0.5 per cent while Nasdaq futures rose […]",,https://michaelwest.com.au/news/asia-shares-firm-on-hopes-for-us-trade-deals/,michaelwest.com.au,2025-05-08T02:44:22.000000Z,NVDA,Technology
9147145f-f5dd-466e-9c01-ebf0b69ea563,NVIDIA Corporation (NVDA): Among Billionaire Mario Gabelli’s Large-Cap Stock Picks with Huge Upside Potential — We recently published a list of Billionaire Mario Gabelli’s 10 Large-Cap Stock Picks with Huge Upside Potential.,,https://www.insidermonkey.com/blog/nvidia-corporation-nvda-among-billionaire-mario-gabellis-large-cap-stock-picks-with-huge-upside-potential-1526267/,insidermonkey.com,2025-05-07T22:00:12.000000Z,"NVDA, NVD.DE, NVDA.MX, NVDC34.SA, NVDA.BA",Technology
ab093c40-ce74-49f8-ab6a-b05c2d31e642,"Wall Street Lunch: Fed Holds Rates, In No Hurry To Cut — Fed keeps rates on hold amid stagflation concerns. Chairman Powell stresses the Fed can wait to see how tariffs shake out. White House ready to kill the AI diffusion rule.",,https://seekingalpha.com/article/4783225-wall-street-lunch-fed-holds-rates-in-no-hurry-to-cut,seekingalpha.com,2025-05-07T21:25:00.000000Z,"AAPL, AVGO, AVGOP, NVDA",Technology
a6d534b9-9c39-4079-a6fb-093c8391edf1,"AMD Relieves Market Despite Ongoing Share Price Outlook Caution — Market Analysis by  covering: NVIDIA Corporation, Advanced Micro Devices Inc. Read 's Market Analysis on Investing.com",,https://www.investing.com/analysis/amd-relieves-market-despite-ongoing-share-price-outlook-caution-200660500,investing.com,2025-05-07T21:02:00.000000Z,"AMD, NVDA",Technology
4ed3fd60-340a-465d-b334-233e8ff8a3e6,AMD to Host Annual Meeting of Stockholders — **media[618130]**,,https://www.manilatimes.net/2025/05/08/tmt-newswire/globenewswire/amd-to-host-annual-meeting-of-stockholders/2108427,manilatimes.net,2025-05-07T20:58:16.000000Z,"AMD, AMD.DE, AMD.MX, A1MD34.SA",Technology
20578228-1591-4196-bfb4-ba350566b629,"Forexlive Americas FX news wrap 7 May: Fed and Chair Powell stays noncommitted — Forex news for North American trading on May 7, 2025",,https://www.forexlive.com/news/forexlive-americas-fx-news-wrap-7-may-fed-and-chair-powell-stay-noncommitted-20250507/,forexlive.com,2025-05-07T20:42:32.000000Z,NVDA,Technology
8b17a7fd-b2f0-4094-836f-762cfc454be1,De-tease: Luke Lango’s “Make AI Great in America” Stocks,,https://www.stockgumshoe.com/reviews/early-stage-investor/de-tease-luke-langos-make-ai-great-in-america-stocks/,stockgumshoe.com,2025-05-07T20:06:47.000000Z,"MKD, AZN, NVDA, MSFT, ISRG, TEM, MSFT.MI, NVDA.MI","Basic Materials, Healthcare, Technology"
297a80ab-b116-444a-a2f6-fb27b2541861,"Market Recap: Stocks Rally on U.S.-China Trade Talk Hopes as Fed Decision Looms — Based on the information gathered, I'll now write the market recap article focusing on the current market indexes, upcoming events, and major stock news for",,https://thestockmarketwatch.com/stock-market-news/market-recap-stocks-rally-on-u-s-china-trade-talk-hopes-as-fed-decision-looms/49417/,thestockmarketwatch.com,2025-05-07T18:01:55.000000Z,"AAPL, AMD, NVDA, MSFT, TSLA, ^HSI","Technology, Consumer Cyclical"
c80cd47c-d4fd-47a9-ba35-1f4598ea8f92,"Jim Cramer Asserts that NVIDIA Corporation (NVDA) Will Experience Sizeable Demand — We recently published an article titled Jim Cramer Says AI Is Back & Discusses These 10 Stocks. In this article, we are going to take a look at where NVIDIA Corporation (NASDAQ:NVDA) stands against the other stocks. In a recent appearance on CNBC’s Squawk on the Street, Jim Cramer commented on how market sentiment towards AI […]",,https://finance.yahoo.com/news/jim-cramer-asserts-nvidia-corporation-160535618.html,finance.yahoo.com,2025-05-07T16:05:35.000000Z,"NVD.DE, NVDA.MX, NVDA, NVDC34.SA, NVDA.BA",Technology
