id,text,y,url,source,published_at,symbols,industries
827b0770-ad7c-4118-92e3-91f52a1c2d00,Nvidia Could Burst The AI Bubble Next Week — Expect Poor Guidance (Downgrade) (NVDA) — Nvidia Corporation's growth slows as the valuation stays high. Upcoming earnings could reveal a Gen AI capex slowdown. Click for my NVDA earnings preview.,,https://seekingalpha.com/article/4760224-nvidia-could-burst-ai-bubble-next-week-expect-poor-guidance-downgrade,seekingalpha.com,2025-02-20T19:07:32.000000Z,"NVD.DE, NVDA, NVDA.MX, NVDC34.SA, NVDA.BA",Technology
2de11eac-b331-4a67-a025-1725f2a14f23,Meta Platforms’ record winning streak puts stock split in view — Meta's record-breaking rally propelled share price to a level where investors may call on the company to split its stock. Read more here,,https://financialpost.com/investing/meta-platforms-streak-puts-stock-split-in-view,thepost.on.ca,2025-02-20T17:31:02.000000Z,"NOW, TYL, AAPL.NE, AMZ.DE, APC.DE, ABEA.DE, TL0.DE, NFC.DE, ABEC.DE, ITU.DE, SYP.DE, 1YD.DE, AAPL, AMZN, GOOG, GOOGL, META, AVGO, AVGOP, NVDA, MSFT, TSLA, NFLX, INTU, SNPS, AMZN.MX, AAPL.MX, GOOGL.MX, GOOG.MX, NFLX.MX, TSLA.MX, TYL.MX, AVGO.MX, NOWW.MX, INTU.MX, 0L5N.L, 0JCT.L, 0LBP.L, 0YXG.L, AVGO34.SA, TSLA34.SA, NFLX34.SA, INTU34.SA, N1OW34.SA, S1NP34.SA, MSFT.MI, NVDA.MI, AAPL.BA, GOOGL.BA, NFLX.BA, NVDAD.BA, NFLXD.BA, TSLAD.BA, MSFTD.BA, AAPLD.BA, MSFTB.BA, MSFTC.BA, TSLAC.BA, NVDAC.BA, AVGO.BA, AVGOD.BA, GOGLD.BA, AAPLC.BA, AMZN.SN, GOOGL.SN, AAPLCL.SN, MSFTCL.SN, AAPL.SN, GOOG.SN, AMZNCL.SN, GOOGCL.SN","Technology, Consumer Cyclical, Communication Services"
8cae5a4d-d0eb-47ac-89c7-c51f585c3239,"Stock Market Today: S&P 500 Retreats from Record Highs Amid Retail Concerns — On Thursday, February 20, 2025, the U.S. stock market is experiencing a pullback after two consecutive days of gains, with major indexes retreating from their",,https://thestockmarketwatch.com/stock-market-news/stock-market-today-sp-500-retreats-from-record-highs-amid-retail-concerns/48946/,thestockmarketwatch.com,2025-02-20T15:28:51.000000Z,"AAPL, GOOGL, NVDA, MSFT, TSLA","Technology, Communication Services, Consumer Cyclical"
275bb917-de94-46fd-8b79-33a59587c6ff,Insights Into NVIDIA's Performance Versus Peers In Semiconductors & Semiconductor Equipment Sector - NVIDIA (NASDAQ:NVDA),,https://www.benzinga.com/insights/news/25/02/43850990/insights-into-nvidias-performance-versus-peers-in-semiconductors-amp-semiconductor-equipment-sector,benzinga.com,2025-02-20T15:00:56.000000Z,"FSLR.MX, SWKS.MX, AVGO.MX, ADI.MX, ASEHN.MX, 0HFN.L, 0KSJ.L, 0YXG.L, 0QYL.L, 0L77.L, 0R06.L, AMD, ADI, AVGO, AVGOP, NVDA, FSLR, MU, SWKS, QRVO, RMBS, ASX, AVGO34.SA, FSLR34.SA, MUTC34.SA, A1MD34.SA, Q1RV34.SA, NVDA.MI, 3711.TW, NVDAD.BA, QCOMD.BA, FSLR.BA, QCOMC.BA, NVDAC.BA, AVGO.BA, AVGOD.BA, ADI.BA, ADID.BA, AMD.DE, MTE.DE, F3A.DE, ANL.DE, 2QO.DE, MCP.DE, RMB.DE, 1YD.DE, AWM.DE, AMD.MX, MU.MX, MPWR, MPWR.MX",Technology
c536ef95-3a5b-4b27-9ab0-11662b0c40bf,Here are our top 5 performing stocks during a topsy-turvy market over the past month — Volatility first ensued on the rise of Chinese startup DeepSeek's AI model in late January.,,https://www.cnbc.com/2025/02/20/our-top-5-performers-during-a-topsy-turvy-market-for-stocks-over-the-past-month.html,cnbc.com,2025-02-20T14:56:26.000000Z,"AAPL, GOOGL, NVDA, MSFT, SBUX, FTNT","Technology, Communication Services, Consumer Cyclical"
a271eed8-4bb7-4c74-96aa-ea5ff3756a84,"Is Broadcom Stock a Better Investment Pick Than NVIDIA Now? — NVDA leads in AI hardware, securing a strong edge, while Broadcom's VMware acquisition boosts its presence in enterprise software.",,https://www.zacks.com/stock/news/2418485/is-broadcom-stock-a-better-investment-pick-than-nvidia-now?cid=CS-ZC-FT-analyst_blog|investment_ideas-2418485,zacks.com,2025-02-20T13:59:00.000000Z,"AVGO, AVGOP, NVDA",Technology
addb025d-02ef-4019-b2f2-e71f2eb02480,"India unlikely to face immediate impact from US chip tariffs, experts say — US President Donald Trump’s threat to levy a 25 per cent tariff on chip imports is set to hit the global semiconductor industry very hard. However, experts see no major impact on India in the short term.",,https://www.thehindubusinessline.com/info-tech/india-unlikely-to-face-immediate-impact-from-us-chip-tariffs-experts-say/article69242907.ece,thehindubusinessline.com,2025-02-20T13:21:28.000000Z,"INL.DE, INTC, INTC.MX, INCO.BR, INTC.SN",Technology
e60b31c8-e2f0-445b-8530-a3ccdc19a62b,"Quantum computing stocks are surging again after Microsoft unveiled its Majorana 1 quantum chip — D-Wave, Rigetti, and Quantum Computing Inc. are enjoying yet another boost in the wake of a major announcement from tech giant Microsoft.",,https://www.fastcompany.com/91281779/quantum-computing-stocks-d-wave-rigetti-surge-microsoft-chip-news?partner=rss&amp;utm_source=rss&amp;utm_medium=feed&amp;utm_campaign=rss+fastcompany&amp;utm_content=rss,fastcompany.com,2025-02-20T13:17:00.000000Z,"NVDA, MSFT, COMP, QUBT, MSFT.MI, NVDA.MI",Technology
fbcfca3d-4bfc-4c1b-89dc-43636c448ce3,"A Surprise Stock Market Warning Is Quietly Flashing Red As The S&P 500, The Dow And The Nasdaq Peak — The stalled bitcoin and crypto market may be quietly flashing a stock market warning...",,https://www.forbes.com/sites/digital-assets/2025/02/20/a-surprise-stock-market-warning-is-quietly-flashing-red-as-the-sp-500-the-dow-and-the-nasdaq-peak/,forbes.com,2025-02-20T13:10:26.000000Z,"AAPL, GOOGL, NVDA, MSFT, TSLA","Technology, Communication Services, Consumer Cyclical"
4a0f9fa0-0bab-4aa1-8fee-7ba1291b10d1,How DeepSeek is challenging the dominance of U.S. AI companies — The rise of DeepSeek challenges the dominance of U.S. Firms and the proprietary model in the AI space.,,https://www.fortuneindia.com/long-reads/how-deepseek-is-challenging-the-dominance-of-us-ai-companies/120578,fortuneindia.com,2025-02-20T11:05:12.000000Z,NVDA,Technology
ada2dde2-4921-4655-9f7e-bbee8409b34d,"Record Investor Confidence May Be a Sign of Coming Stock Market Crash — From Trump tariffs to AI overconfidence, investors are ignoring a lot of worries right now. That could be a dangerous sign for the stock market.",,https://www.businessinsider.com/record-investor-confidence-stock-market-wall-street-crash-sell-off-2025-2,businessinsider.com,2025-02-20T09:03:02.000000Z,NVDA,Technology
298fda7e-d782-47d2-8111-6afb199be21b,"Nvidia (NVDA) Stock Sinks As Market Gains: Here's Why — Nvidia (NVDA) closed at $139.23 in the latest trading session, marking a -0.12% move from the prior day.",,https://www.zacks.com/stock/news/2418114/nvidia-nvda-stock-sinks-as-market-gains-heres-why?cid=CS-ZC-FT-tale_of_the_tape|yseop_template_6-2418114,zacks.com,2025-02-19T22:45:19.000000Z,NVDA,Technology
b595459c-3db1-4546-8303-bc8768dbcb9b,"NVIDIA Corporation (NVDA) Expected to Deliver Strong Results, UBS Stays Bullish — We recently compiled a list of the 15 AI Stocks Every Investor Should Be Watching. In this article, we are going to take a look at where NVIDIA Corporation (NASDAQ:NVDA) stands against the other AI stocks...",,https://www.insidermonkey.com/blog/nvidia-corporation-nvda-expected-to-deliver-strong-results-ubs-stays-bullish-1457910/,insidermonkey.com,2025-02-19T22:26:55.000000Z,"NVD.DE, NVDA, NVDA.MX, NVDC34.SA, NVDA.BA",Technology
c4ab1aa0-8cf6-43e0-ad2f-197e66360f0b,"Market Recap: S&P 500 Hits New Record Amid Tariff Concerns and Fed Minutes — On Wednesday, February 19, 2025, the U.S. stock market showed mixed performance as investors navigated through a complex landscape of record highs, tariff",,https://thestockmarketwatch.com/stock-market-news/market-recap-sp-500-hits-new-record-amid-tariff-concerns-and-fed-minutes/48942/,thestockmarketwatch.com,2025-02-19T22:01:38.000000Z,"INTC.SN, NVDA, INTC, SMCI, ETSY, WING, CE, NVD.DE, INL.DE, INTC.MX, NVDA.MX, 0HUR.L, INCO.BR, NVDC34.SA, C1NS34.SA, NVDA.BA","Technology, Consumer Cyclical, Basic Materials"
62ece063-7614-4ddd-b83b-569f78d219c1,"Advanced Micro Devices, Inc. (AMD) — Advanced Micro Devices, Inc. (AMD) - Anyone invested in this company, advanced money destroyer? The chart looks like its breaking out to the upside.",,https://forums.redflagdeals.com/advanced-micro-devices-inc-amd-2747646/#p39998157,forums.redflagdeals.com,2025-02-19T20:10:42.000000Z,"AMD.MX, AMD, A1MD34.SA, AMD.DE",Technology
eecf06ae-af33-4cd6-9c6e-61dc2f17e643,"Predicting The S&P 500 With An 85% Correlation - iShares Core S&P 500 ETF (ARCA:IVV), SPDR S&P 500 (ARCA:SPY) — The versatile and multi-faceted Gav Blaxberg offers his expert perspective on how 'The Rich Predict The S&P Year After Year.",,https://www.benzinga.com/markets/equities/25/02/43827755/theres-a-way-to-predict-the-s-p-500-with-an-85-correlation,benzinga.com,2025-02-19T20:01:20.000000Z,"IVV, AAPL, NVDA, MSFT",Technology
39a9789a-541a-4033-8caf-11671bb8ca82,Stocks fall amid inflation and Trump tariffs — Stocks tumble as inflation worries and new Trump tariffs cause market uncertainty.,,https://www.under30ceo.com/stocks-fall-amid-inflation-and-trump-tariffs/,under30ceo.com,2025-02-19T20:01:00.000000Z,"GOOGL, AVGO, AVGOP, NVDA, MSFT, TXRH","Communication Services, Technology, Consumer Cyclical"
bf2ede28-b33e-43a8-942f-2cae099da604,"Why Meta Platforms Stock Is Slipping Today — Meta Platforms (NASDAQ: META) stock is losing ground Wednesday.  Meta's valuation is moving lower following news that its WhatsApp messaging platform will fall under new regulations in the European Union.  In a filing submitted on Feb. 14, Meta Platforms revealed that it had roughly 46.8 million average monthly active users on its WhatsApp platform across the six-month period that concluded on Dec. 31.",,https://finance.yahoo.com/news/why-meta-platforms-stock-slipping-192522779.html,finance.yahoo.com,2025-02-19T19:25:22.000000Z,"AAPL, META, NVDA, NFLX","Technology, Communication Services"
b51b07cf-61b4-4e8a-8c4d-5dff1706083a,Semtech Shares Plummet on AI Server Woes—Is a Turnaround Ahead? — Stocks Analysis by Leo Miller covering: Semtech Corporation. Read Leo Miller's latest article on Investing.com,,https://www.investing.com/analysis/semtech-shares-plummet-on-ai-server-woesis-a-turnaround-ahead-200657532,investing.com,2025-02-19T16:48:00.000000Z,"NVDA, SMTC",Technology
0e179c44-cab9-4af7-bb3f-eafd461c2a75,"Patient capital is the missing piece in Canada's innovation puzzle — Patient venture capital, allowing startups the time to scale, is not just a luxury; it is a necessity for Canada’s economic growth. Read on",,https://financialpost.com/technology/patient-capital-the-missing-piece-in-canadas-innovation-puzzle,financialpost.com,2025-02-19T15:45:21.000000Z,"AVGO34.SA, A1MD34.SA, NVDA.MI, NVDAD.BA, NVDAC.BA, AVGO.BA, AVGOD.BA, AMD, AVGO, AVGOP, AMD.DE, 1YD.DE, AMD.MX, AVGO.MX, 0YXG.L",Technology
f1f581e8-11f1-44ea-a855-12675f68744b,"AI revolution 2.0: 3 must-have stocks to Buy and Hold for long-term gains — The second wave of the AI revolution focuses on AI-based platforms. According to The Motley Fool, the stocks to watch include CrowdStrike, Alphabet, and Apple. CrowdStrike is a leader in AI-powered cybersecurity, Alphabet is investing heavily in AI to reclaim leadership, and Apple aims to leverage its massive iOS user base for consumer-facing AI products.",,https://economictimes.indiatimes.com/news/international/us/ai-revolution-2-0-3-must-have-stocks-to-buy-and-hold-for-long-term-gains/articleshow/118391085.cms,economictimes.indiatimes.com,2025-02-19T14:23:51.000000Z,"AAPL, GOOGL, NVDA, CRWD","Technology, Communication Services"
bae92227-75f9-4bd4-8477-aaa4b23e5352,"AMD Before Nvidia’s Earnings: Is It The Next Intel? (NASDAQ:AMD) — Is Advanced Micro Devices, Inc. the next Nvidia or Intel? Explore AMD's Q4 results, AI market potential, and competition. Read more on AMD, NVDA, and INTC.",,https://seekingalpha.com/article/4759559-amd-before-nvidia-earnings-is-it-the-next-intel,seekingalpha.com,2025-02-19T14:16:47.000000Z,"INTC, INTC.MX, INCO.BR, INTC.SN, INL.DE",Technology
fc11e7ee-daef-4930-8056-d80f360a9f22,"Jim Cramer's top 10 things to watch in the stock market Wednesday — Wall Street was headed for a mixed open, the morning after the S&P 500 closed at a record high.",,https://www.cnbc.com/2025/02/19/jim-cramers-top-10-things-to-watch-in-the-stock-market-wednesday.html,cnbc.com,2025-02-19T14:00:31.000000Z,"AAPL, NVDA, MSCL.SN",Technology
b61cb41b-7d74-4eb4-8d61-f4201e30b350,"Futures Slide After Trump Threatens 25% Tariffs, FOMC Minutes Loom — ZeroHedge - On a long enough timeline, the survival rate for everyone drops to zero",,https://www.zerohedge.com/markets/futures-slide-after-trump-threatens-25-tariffs-fomc-minutes-loom,zerohedge.com,2025-02-19T13:25:13.000000Z,"SUPN, AVGO, AVGOP, NVDA, CDNS, 1ST.AX, SMCI, ^AXJO, ETSY, MTLS, BMBL, ^HSI, NVDA.MI, ^N225, USDCNY, USDJPY, AUDCAD, EURUSD, CADJPY","Healthcare, Technology, Consumer Cyclical"
18146b6e-0f95-4c5a-9166-ec92e02d199b,"Super Micro Computer stock: 2 reasons why SMCI is surging this week as its latest delisting deadline nears — Tech giant Super Micro Computer, which has been delinquent in filing SEC paperwork, says it believes it will make a critical deadline.",,https://www.fastcompany.com/91281030/smci-stock-price-super-micro-computer-rising-why-delisting-deadline?partner=rss&amp;utm_source=rss&amp;utm_medium=feed&amp;utm_campaign=rss+fastcompany&amp;utm_content=rss,fastcompany.com,2025-02-19T13:23:00.000000Z,"NVDA, SMCI",Technology
893b624d-6958-493e-8302-9245fa470ded,WeRide Soars Another 28% After Nvidia Stake Revealed — Nasdaq-traded shares have more than doubled since IPO in October,,https://www.forbes.com/sites/forbeschina/2025/02/19/weride-soars-another-28-after-nvidia-stake-revealed/,forbes.com,2025-02-19T07:46:34.000000Z,"BIDU, NVDA, BAIDF, BIDUN.MX, 9888.HK, BIDU.BA, BIDUD.BA","Communication Services, Technology"
47d4221e-9d76-4b7c-b1dc-704892170d24,"WeRide’s Stock Price Surged Again, with the Support of NVIDIA’s Million-Share Position — WeRide's stock price has surged again, with the company's share price exceeding $40 and its market value surpassing $11 billion.",,https://pandaily.com/werides-stock-price-surged-again-with-the-support-of-nvidias-million-share-position/,pandaily.com,2025-02-19T06:33:16.000000Z,NVDA,Technology
12f5ff09-8ad8-4fc0-9a40-ea01460b1d7c,"NVIDIA's Strategic Moves and Chinese Tech Stocks Performance — Following the U.S. stock market opening, major indices showed mixed movements. Notably, NVIDIA (NVDA) experienced a surge of over 3%, while Intel (INTC) saw an",,https://www.gurufocus.com/news/2702885/nvidias-strategic-moves-and-chinese-tech-stocks-performance,gurufocus.com,2025-02-18T22:50:58.000000Z,"BIDU, AVGO, BILI, AVGOP, NVDA, IQ","Communication Services, Technology"
357616ff-3fbc-4bf7-9674-b6a46cd3dafc,"Market Recap: S&P 500 Sets New Record as Tech Stocks Lead the Charge — The U.S. stock market closed on a positive note on Tuesday, February 18, 2025, with the S&P 500 reaching a new all-time high. This upbeat performance",,https://thestockmarketwatch.com/stock-market-news/market-recap-sp-500-sets-new-record-as-tech-stocks-lead-the-charge/48935/,thestockmarketwatch.com,2025-02-18T22:28:37.000000Z,"AVGO, AVGOP, NVDA, SMCI, TSLA","Technology, Consumer Cyclical"
51b1cb00-72d1-44b9-ba82-3a80a25b5c00,"Strong Start To Weak Season: Can Market Momentum Continue? — [Chart courtesy of MarketWatch.com] The markets showed little activity early on, with the S&P 500 trading near its highs and eventually closing at a new all-time high. Some tech stocks, including Intel, Nvidia, and Microsoft, posted gains, with Intel leading the pack and achieving its largest two-week increase on record. Meanwhile, Meta’s 20-day win streak came to an end, causing ... Read More",,https://theetfbully.com/2025/02/strong-start-to-weak-season-can-market-momentum-continue/,theetfbully.com,2025-02-18T21:48:40.000000Z,"NVDA, MSFT",Technology
afa1553d-cd2e-4260-9929-42d1bdc2435b,Silver Lake nears deal for stake in Intel's Altera (INTC:NASDAQ) — Silver Lake in talks to acquire a majority stake in Intel's Altera unit.,,https://seekingalpha.com/news/4409561-silver-lake-nears-deal-for-stake-in-intels-altera,seekingalpha.com,2025-02-18T20:04:20.000000Z,INTC,Technology
7b5919f8-d4b7-44d9-9019-bf681a172cb7,"NVIDIA Corporation (NVDA): Among the Semiconductor Stocks Making Impressive Comeback from DeepSeek AI Dip — We recently compiled a list of the 15 Semiconductor Stocks Making Impressive Comeback From DeepSeek AI Dip. In this article, we are going to take a look at where NVIDIA Corporation (NASDAQ:NVDA) stands...",,https://www.insidermonkey.com/blog/nvidia-corporation-nvda-among-the-semiconductor-stocks-making-impressive-comeback-from-deepseek-ai-dip-1455235/,insidermonkey.com,2025-02-18T19:45:20.000000Z,"NVDA.MX, NVDA, NVDC34.SA, NVDA.BA, NVD.DE",Technology
49301d50-d398-4ad8-adc7-bdd88bbd528a,"INTC stock price: Intel jumps over 10% after report that Broadcom, TSMC bids could split the struggling chipmaker — The American chipmaker missed out on the generative AI boom and is now in talks with rivals to which it lost market share, according to a report from the Wall Street Journal. INTC stock is up on the news.",,https://www.fastcompany.com/91280353/intc-stock-price-up-intel-split-by-broadcom-tsmc-bids-ai-chipmaker-report?partner=rss&amp;utm_source=rss&amp;utm_medium=feed&amp;utm_campaign=rss+fastcompany&amp;utm_content=rss,fastcompany.com,2025-02-18T19:00:00.000000Z,"AVGO, INTC, INCO.BR, INTC.SN, INL.DE, INTC.MX",Technology
560e3aab-492d-4d51-acd5-ace7e7c2cc8f,Inquiry Into NVIDIA's Competitor Dynamics In Semiconductors & Semiconductor Equipment Industry - NVIDIA (NASDAQ:NVDA),,https://www.benzinga.com/insights/news/25/02/43784798/inquiry-into-nvidias-competitor-dynamics-in-semiconductors-amp-semiconductor-equipment-industry,benzinga.com,2025-02-18T15:00:13.000000Z,"0L77.L, 0R06.L, AMD, ADI, AVGO, AVGOP, NVDA, FSLR, MU, SWKS, QRVO, MPWR, ASX, AVGO34.SA, FSLR34.SA, MUTC34.SA, A1MD34.SA, Q1RV34.SA, NVDA.MI, 3711.TW, NVDAD.BA, QCOMD.BA, FSLR.BA, QCOMC.BA, NVDAC.BA, AVGO.BA, AVGOD.BA, ADI.BA, ADID.BA, AMD.DE, MTE.DE, F3A.DE, ANL.DE, 2QO.DE, MCP.DE, 1YD.DE, AWM.DE, AMD.MX, MU.MX, FSLR.MX, SWKS.MX, AVGO.MX, ADI.MX, ASEHN.MX, MPWR.MX, 0HFN.L, 0KSJ.L, 0YXG.L",Technology
267eaaf9-bd23-4435-9996-23bb819c865a,S&P 500 unchanged as retail report looms — The S&P 500 remains flat as investors brace for the upcoming retail sales report.,,https://www.under30ceo.com/sp-500-unchanged-as-retail-report-looms/,under30ceo.com,2025-02-18T14:07:00.000000Z,"NVDA, WMG, NWE, ROKU","Technology, Communication Services, Utilities"
5e7d43ef-e40e-434f-afb6-62b9cc693125,"Sponsorship Proposal for Nathan Copeland’s Lifetime BCI Support — I am writing to you as a committed advocate for the ethical advancement of neurotechnology, with a focus on the long-term well-being of the pioneers whose participation in brain-computer interface…",,https://medium.com/@mariambrian/sponsorship-proposal-for-nathan-copelands-lifetime-bci-support-0884d56b596d,medium.com,2025-02-18T14:04:30.000000Z,"NVDA, NVDA.MX, NVDC34.SA, NVDA.BA, NVD.DE",Technology
967cac4f-85f5-4a32-b1eb-f1cb30a4bd4d,Super Micro Computer Soars 26% in a Week—More Upside Ahead? — Stocks Analysis by MarketBeat.com (Gabriel Osorio-Mazzilli) covering: Super Micro Computer Inc. Read MarketBeat.com (Gabriel Osorio-Mazzilli)'s latest article on Investing.com,,https://www.investing.com/analysis/super-micro-computer-soars-26-in-a-weekmore-upside-ahead-200657473,investing.com,2025-02-18T13:51:00.000000Z,"NVDA, SMCI",Technology
0fa1f3dc-ce25-4e42-884f-e8d624160936,"US Futures, Global Markets Rise As Russia-US Talks Seek End To Ukraine War — ZeroHedge - On a long enough timeline, the survival rate for everyone drops to zero",,https://www.zerohedge.com/markets/us-futures-global-markets-rise-russia-us-talks-seek-end-ukraine-war,zerohedge.com,2025-02-18T13:29:01.000000Z,"ICHGF, IHG.L, AAPL, AVGO, SLDB, AVGOP, NVDA, HEES, ^AXJO, IHG, ^HSI, I1HG34.SA, BRKB.BA, BRKBD.BA, BRKBB.BA, MSCL.SN, ^N225, USDCNY, USDJPY","Consumer Cyclical, Technology, Healthcare, Industrials"
b1404acb-bd04-426d-a81c-a8cd005186cb,"Prediction: Nvidia Stock Is Going to Drop After Feb. 26 — Tech giants are dumping mountains of cash into artificial intelligence (AI) data centers.  Amazon is boosting its total capital spending, spread across its retail and cloud businesses, to $100 billion to accelerate its AI efforts.  The company dominates the market for powerful AI accelerators, and second place AMD has already put forth a disappointing forecast for its own AI chips sales this year.",,https://finance.yahoo.com/news/prediction-nvidia-stock-going-drop-131500159.html,finance.yahoo.com,2025-02-18T13:15:00.000000Z,"AMD, NVDA, MSFT",Technology
6e07073f-f682-4c49-b33a-2b1d2ebc1154,"Cathie Wood (ARK) sur Musk, Trump, DeepSeek et le Bitcoin",,https://www.morningstar.fr/fr/news/260992/cathie-wood-(ark)-sur-musk-trump-deepseek-et-le-bitcoin.aspx,morningstar.fr,2025-02-18T06:00:00.000000Z,"NVDA, TSLA","Technology, Consumer Cyclical"
7b96061e-d052-48be-b2a2-17fe6fba0135,Intel’s Decline: A Cautionary Tale For Technology Investors — RIP Intel Corporation: The tech sector marks a major turning point today with stories of Intel possibly being sold off and TSMC and Broadcom showing interest in acquir...,,https://www.forbes.com/sites/jimosman/2025/02/17/intels-decline-a-cautionary-tale-for-technology-investors/,forbes.com,2025-02-17T23:22:42.000000Z,"AAPL, AVGO, AVGOP, NVDA, MSFT",Technology
c7a5c852-8f8f-48f7-9c51-520b09add56e,"Amazon, Microsoft, Alphabet, and Meta Just Gave Nvidia Great News. But Does That Make The Stock A Buy Before Feb. 26? — Nvidia's",,https://finance.yahoo.com/news/amazon-microsoft-alphabet-meta-just-231500125.html,finance.yahoo.com,2025-02-17T23:15:00.000000Z,"AAPL, GOOGL, NVDA, MSFT, NFLX","Technology, Communication Services"
7dfcfaf1-77a2-4777-96f1-278200eb9302,"Market Recap: U.S. Markets Closed for Presidents’ Day as Global Stocks Show Mixed Performance — On Monday, February 17, 2025, U.S. financial markets, including the New York Stock Exchange (NYSE) and Nasdaq, remained closed in observance of Presidents'",,https://thestockmarketwatch.com/stock-market-news/market-recap-u-s-markets-closed-for-presidents-day-as-global-stocks-show-mixed-performance/48927/,thestockmarketwatch.com,2025-02-17T22:28:35.000000Z,"NVDA, SMCI, ETSY, CVNA, SPXC, WMT, 399233.SZ","Technology, Consumer Cyclical, Industrials, Consumer Defensive"
7a3ba4df-996b-4515-9a57-51c71f79666f,"MPWR Investors Have Opportunity to Lead Monolithic Power Systems, Inc. Securities Fraud Lawsuit — PR NewswireNEW YORK, Feb. 17, 2025



NEW YORK, Feb. 17, 2025 /PRNewswire/ -- Rosen Law Firm, a global investor rights law firm, announces the filing of a cla",,https://www.gurufocus.com/news/2701337/mpwr-investors-have-opportunity-to-lead-monolithic-power-systems-inc-securities-fraud-lawsuit,gurufocus.com,2025-02-17T22:00:06.000000Z,"NVDA, MPWR, MPWR.MX",Technology
6f564f34-d600-4f9c-970c-d06ab65c01c3,Is Taiwan Semiconductor Manufacturing (TSM) the Most Profitable Tech Stock to Buy Now? — We recently published a list of 10 Most Profitable Tech Stocks to Buy Now.,,https://www.insidermonkey.com/blog/is-taiwan-semiconductor-manufacturing-tsm-the-most-profitable-tech-stock-to-buy-now-1455418/,insidermonkey.com,2025-02-17T20:35:32.000000Z,"TSMN.MX, INTC, TSM, 2330.TW, TSM.BA, INTCD.BA, INTCCL.SN",Technology
a4b7491c-f213-43cb-a87c-13124816fc1e,"Nvidia’s AI dominance remains intact despite challenges from DeepSeek — Despite concerns over DeepSeek's AI breakthrough, Nvidia's strong industry links and the ongoing demand for AI infrastructure have kept its growth outlook solid.",,https://economictimes.indiatimes.com/news/international/us/nvidias-ai-dominance-remains-intact-despite-challenges-from-deepseek/articleshow/118337759.cms,economictimes.indiatimes.com,2025-02-17T18:32:47.000000Z,"AAPL, GOOGL, NVDA, MSFT","Technology, Communication Services"
89b83e2b-435c-454f-a838-d422f1924f8c,These are the two big things we're watching in the stock market in the week ahead — Housing data and earnings from our newest Club holding are big events in the holiday-shortened week.,,https://www.cnbc.com/2025/02/17/two-big-things-were-watching-in-the-stock-market-in-the-week-ahead.html,cnbc.com,2025-02-17T17:45:20.000000Z,"AAPL, BIDU, BRKB.BA, BRKBD.BA, BRKBB.BA, NVDA, SBUX, ETSY, HAS, TXRH, NVDA.MI, SBUX.MI","Technology, Communication Services, Consumer Cyclical"
5627e9b4-cc35-4c4f-8e2b-45c4a4a39794,SoundHound AI: The Bubble Is Bursting (NASDAQ:SOUN) — Nvidia's exit impacts SoundHound AI's stock amidst overvaluation concerns. Click here to find out why I rate SOUN stock a Sell.,,https://seekingalpha.com/article/4759007-soundhound-ai-stock-excessive-valuation-maintain-sell,seekingalpha.com,2025-02-17T17:10:39.000000Z,"NVDA, SOUN",Technology
bae17156-92fd-4d17-acfb-fa2d0306158f,"VEEA® and VAPOR IO Announce a Strategic Partnership to Provide Turnkey AI-as-a-Service Pioneering Solutions for AI Inferencing, Federated Learning, Agentic AI and AIoT — **media[542520]**",,https://www.manilatimes.net/2025/02/17/tmt-newswire/globenewswire/veea-and-vapor-io-announce-a-strategic-partnership-to-provide-turnkey-ai-as-a-service-pioneering-solutions-for-ai-inferencing-federated-learning-agentic-ai-and-aiot/2057012,manilatimes.net,2025-02-17T14:59:29.000000Z,"NVDA, MSFT",Technology
ff96cbed-3ff5-47ab-b244-c9b0176c1952,"US Futures Rise As Europe Hits All Time High, Boosted By Defense Stocks — ZeroHedge - On a long enough timeline, the survival rate for everyone drops to zero",,https://www.zerohedge.com/markets/us-futures-rise-europe-hits-all-time-high-boosted-defense-stocks,zerohedge.com,2025-02-17T14:19:10.000000Z,"BIDU, NVDA, NTES, SONY, NVDA.MI, RIOD.BA","Communication Services, Technology"
