id,text,y,url,source,published_at,symbols,industries
81e3280f-9cc5-4c59-ba9f-15425991bc78,"Science Applications Posts Better-Than-Expected Earnings, Joins Qifu Technology, Baidu, American Eagle And Other Big Stocks Moving Higher On Monday - Alpha Technology Group (NASDAQ:ATGL), American Eag",,https://www.benzinga.com/25/03/44361721/science-applications-posts-better-than-expected-earnings-joins-qifu-technology-baidu-american-eagle-and-other-big,benzinga.com,2025-03-17T17:54:56.000000Z,"GES, BIDUN.MX, INTC.MX, BAIDF, EQOS, BIDU, INTC, CALM, SAIC, INCO.BR, 9888.HK, BIDU.BA, BIDUD.BA, INTC.SN, INL.DE","Consumer Cyclical, Communication Services, Technology, Financial Services, Consumer Defensive"
1c33f7e2-f6b7-405a-9a41-b2b5e00c0628,Are We Witnessing Alphabet Transform Into the Old IBM? — The future of Google's parent company's looks murkier than ever.,,https://finance.yahoo.com/news/witnessing-alphabet-transform-old-ibm-160000023.html,finance.yahoo.com,2025-03-17T16:00:00.000000Z,"AAPL, GOOG, GOOGL, NVDA, MSFT, NFLX, IBM","Technology, Communication Services"
57dedc3c-a90c-40d1-af41-2ddd7882b5c7,"Retail Sales Stir Concerns as the Fed Prepares Its Policy Update — Market Analysis by  covering: Bitcoin, SoFi Technologies Inc.. Read 's Market Analysis on Investing.com",,https://www.investing.com/analysis/retail-sales-stir-concerns-as-the-fed-prepares-its-policy-update-200658389,investing.com,2025-03-17T14:01:00.000000Z,"NVDA, SOFI, FDX, NIO, XPEV","Technology, Financial Services, Industrials, Consumer Cyclical"
8779b64b-f828-42d5-a140-5e6f09f78d35,"Advanced Micro Devices, Inc. (AMD) is Attracting Investor Attention: Here is What You Should Know — Advanced Micro (AMD) has received quite a bit of attention from Zacks.com users lately. Therefore, it is wise to be aware of the facts that can impact the stock's prospects.",,https://www.zacks.com/stock/news/2430661/advanced-micro-devices-inc-amd-is-attracting-investor-attention-here-is-what-you-should-know?cid=CS-ZC-FT-tale_of_the_tape|most_searched_stocks-2430661,zacks.com,2025-03-17T13:00:13.000000Z,"AMD, AMD.DE, AMD.MX, A1MD34.SA",Technology
a34fad24-62ac-4e4a-8520-ed79b6db6e8c,"Futures Fall After Bessent Says ""Not Worried"" By Slide In US Stocks — ZeroHedge - On a long enough timeline, the survival rate for everyone drops to zero",,https://www.zerohedge.com/markets/futures-fall-after-bessent-says-not-worried-slide-us-stocks,zerohedge.com,2025-03-17T12:16:16.000000Z,"AAPL, GOOGL, NVDA, MSFT, INCY, DOCU, SFM, FRTA, TSLA, NFLX, 399300.SZ, ^AXJO, ^HSI, 000300.SS, ^N225, USDCNY, USDJPY, EURGBP","Technology, Communication Services, Healthcare, Consumer Defensive, Industrials, Consumer Cyclical"
4b32d072-a1d6-4e82-acd8-9b48fff083d0,"5 Things to Know Before the Stock Market Opens — U.S. stock futures tick lower ahead of this week's Fed meeting, the Nvidia GTC conference opens, and gold is in focus after the precious metal tops $3,000. Here's what investors need to know today.",,https://www.investopedia.com/5-things-to-know-before-the-stock-market-opens-march-17-2025-11698052,investopedia.com,2025-03-17T11:55:26.000000Z,"BIDU, NVDA","Communication Services, Technology"
6b03be6d-12cb-4aa7-bf3f-d37dda6b046b,"F5 Accelerates AI At The Edge For Service Providers With NVIDIA BlueField-3 DPUs — F5 BIG-IP Next Cloud-Native Network Functions deployed on NVIDIA BlueField-3 DPUs turbocharge data management and security, unlocking new edge AI innovations and driving the future of AI-RAN",,https://www.scoop.co.nz/stories/BU2503/S00270/f5-accelerates-ai-at-the-edge-for-service-providers-with-nvidia-bluefield-3-dpus.htm,scoop.co.nz,2025-03-17T00:30:00.000000Z,NVDA,Technology
1355f3cb-8fe7-4476-8f86-8c0b87ff467f,"Nvidia Stock Is Down 20%. Is It Time to Buy the Dip on the AI Leader? — It's been a rough start to the year for Nvidia (NASDAQ: NVDA) shareholders.  Late last month, Nvidia reported fourth-quarter and full-year earnings for its fiscal 2025 period, which ended Jan. 26.  Nvidia impressed analysts and investors once again by exceeding both top- and bottom-line estimates.",,https://finance.yahoo.com/news/nvidia-stock-down-20-time-224400525.html,finance.yahoo.com,2025-03-16T22:44:00.000000Z,NVDA,Technology
4bb6978c-5681-4dc7-9d11-9b01ce390a10,"Jim Cramer: “I Think Alphabet (GOOGL) Misses – Google Search Isn’t as Effective Anymore!” — We recently published a list of Jim Cramer Discusses These 10 Stocks & Says President Trump Should Be Like Steve McQueen. In this article, we are going to take a look at where Alphabet Inc.",,https://www.insidermonkey.com/blog/jim-cramer-i-think-alphabet-googl-misses-google-search-isnt-as-effective-anymore-1482314/,insidermonkey.com,2025-03-16T20:03:38.000000Z,"ABEA.DE, ABEC.DE, GOOGL.MX, GOOG.MX, GOOG, GOOGL, NVDA, TSLA, NVDA.MI, GOOGL.BA, GOGLD.BA, GOOGL.SN, GOOG.SN, GOOGCL.SN","Communication Services, Technology, Consumer Cyclical"
8774161f-4d90-46c4-ad22-7bfe174fad72,Wall Street Brunch: Nvidia GTC To The Rescue? (undefined:NVDA) — Bullish AI news from Nvidia’s GTC conference could lure in investors shunning risk. Fed’s Jay Powell will find it tougher to dodge tariff questions. Bill Gross weighs in on tariffs,,https://seekingalpha.com/article/4768003-wall-street-brunch-is-the-force-still-with-nvidia,seekingalpha.com,2025-03-16T19:20:00.000000Z,NVDA,Technology
61bd59f9-567f-4e20-ace5-fa8af9dda2f8,These are the 4 biggest things we're watching in the stock market this week — Fed Chair Jerome Powell's press conference and Nvidia CEO Jensen Huang's GTC keynote are influential events.,,https://www.cnbc.com/2025/03/16/these-are-the-4-biggest-things-were-watching-in-the-stock-market-this-week.html,cnbc.com,2025-03-16T16:02:19.000000Z,"NVDA, SCVL, SCHL, SNDL, MU, PDD, TXRH, SRAD, AJG, DBI, GIS, NIO, NKE, JBL, NKE.DE, GRM.DE, LE, NION.MX, PDDN.MX, NKE.MX, GIS.MX, AJG.MX, 0A1K.L, 0R1X.L, 0ITL.L, NKE.BA, NKED.BA, NKE.SN, NKECL.SN","Technology, Consumer Cyclical, Communication Services, Healthcare, Financial Services, Consumer Defensive"
775afa9f-d4ed-4ff3-8890-7ad7799e70a4,"On the anniversary of the dot-com bubble bursting, is history repeating itself? — In this Sunday edition of BI Today, we're talking about the current market's similarities to the dot-com bubble burst almost exactly 25 years ago.",,https://www.businessinsider.com/bi-today-dot-com-bubble-bursting-anniversary-history-repeating-2025-3,businessinsider.com,2025-03-16T11:09:20.000000Z,"AAPL, NVDA, TSLA","Technology, Consumer Cyclical"
bee0cc6b-d4db-448e-b487-4975170e57a3,"Jim Cramer on NVIDIA Corporation (NVDA): ‘Can’t Wait To Hear That Jensen Keynote’ — We recently published an article titled Jim Cramer Talked About These 7 Stocks Recently. In this article, we are going to take a look at where NVIDIA Corporation (NASDAQ:NVDA) stands against the other...",,https://www.insidermonkey.com/blog/jim-cramer-on-nvidia-corporation-nvda-cant-wait-to-hear-that-jensen-keynote-1482470/,insidermonkey.com,2025-03-15T22:30:08.000000Z,"NVDA, NVDC34.SA, NVDA.MI, NVDA.BA, NVD.DE, NVDA.MX",Technology
718bcec2-fd6c-4647-975f-fdc62506298f,"Intel’s New CEO Brings Optimism, But 2021’s Story Still Resonates — When Pat Gelsinger rejoined Intel Corporation as their new CEO in 2021, there was immense enthusiasm. Pat was no stranger to Intel as he had spent 30 years at the company earlier in his career…",,https://medium.com/@nurshatfatehali/intels-new-ceo-brings-optimism-but-2021-s-story-still-resonates-19430c7a51ab,medium.com,2025-03-15T19:45:44.000000Z,"INCO.BR, INTC.SN, INTC, INL.DE, INTC.MX",Technology
0f2fc929-d53b-4542-b74f-52075680b651,"3 Artificial Intelligence (AI) Stocks That Can Weather President Trump's Tariff Storm — The threat of tariffs looms over many companies because they make anything imported more expensive.  Furthermore, if products become more expensive in general due to tariffs, it could reduce consumer confidence and cause spending to drop across the board.  Many investors are worried about this, which is why the stock market has sold off so heavily over the past week.",,https://finance.yahoo.com/news/3-artificial-intelligence-ai-stocks-183000579.html,finance.yahoo.com,2025-03-15T18:30:00.000000Z,"AVGO, AVGOP, NVDA",Technology
1c95321b-5629-4597-ad47-06f30f1e2252,"This 15.6% Dividend Is A Smart ‘Buy The Dip’ Play — There are two things I need to bring to your attention right now, especially if you’re an income investor (Hint: 1 is a monster dividend yield!)",,https://www.forbes.com/sites/michaelfoster/2025/03/15/this-156-dividend-is-a-smart-buy-the-dip-play/,forbes.com,2025-03-15T14:02:00.000000Z,"NVDA, MRVL, NVDA.MI",Technology
196b63b1-0932-497c-bb9c-800102d835cb,The Poor Man’s Covered Call: Can We Use ITM Covered Call Strikes?,,https://www.thebluecollarinvestor.com/test-featured-img02-2-2-2-3/,thebluecollarinvestor.com,2025-03-15T10:32:45.000000Z,"YI, NVDA","Healthcare, Technology"
586fd19b-d860-422d-a400-4de3acefd1fc,Ross Gerber sees no upside to Tesla stock. Here are the trades he's making instead. — Longtime Tesla investor Ross Gerber recently told BI he sees no path for a rebound in the stock. Here are the other areas of the market he's been playing in.,,https://www.businessinsider.com/tesla-stock-ross-gerber-picks-nvidia-meta-bitcoin-buy-gold-2025-3,businessinsider.com,2025-03-15T08:15:01.000000Z,"NVDA, TSLA","Technology, Consumer Cyclical"
c97667a9-5f9d-4334-9ced-117dc7a81049,"US Stock Market Rises; Nvidia (NVDA) Leads Tech Surge — The US stock market saw a significant uptick, with major indices closing higher. The Dow Jones Industrial Average rose by 1.65%, the Nasdaq by 2.61%, and the S&",,https://www.gurufocus.com/news/2739575/us-stock-market-rises-nvidia-nvda-leads-tech-surge,gurufocus.com,2025-03-15T08:10:30.000000Z,"FUTU, LI, AVGO, AVGOP, NVDA, MSFT, SMCI, JD, TSLA, MU, MSCL.SN","Financial Services, Consumer Cyclical, Technology"
23544191-385e-4861-aedc-0bda517b3616,"US stocks end sharply higher as selloff prompts dip-buying rally — U.S. stocks witnessed a strong rebound on Friday, driven by bargain-hunting after a week of trade war-induced recession fears. Major indexes, including the S&P 500 and Nasdaq, saw significant gains, particularly in tech-related sectors. Despite Fridays rally, both indexes experienced their fourth consecutive weekly losses. Uncertainties around Trump's tariff policies continue to worry investors.",,https://economictimes.indiatimes.com/markets/stocks/news/us-stocks-end-sharply-higher-as-selloff-prompts-dip-buying-rally/articleshow/119030977.cms,economictimes.indiatimes.com,2025-03-15T04:02:54.000000Z,"NVDA, TSLA, CULP","Technology, Consumer Cyclical"
a68c633c-41db-4115-8933-817e0e7f5820,"Market Today: Consumer Sentiment Plummets, Palantir Gains on AI Developments — The stock market experienced a significant rally, bouncing back from recent declines. The S&P 500 surged 2.1%, the Dow Jones Industrial Average rose by 674 poin",,https://www.gurufocus.com/news/2739385/market-today-consumer-sentiment-plummets-palantir-gains-on-ai-developments,gurufocus.com,2025-03-14T22:32:36.000000Z,"ALT, AMGN, ULTA, COST, NVDA, DOCU, TSLA, REGN, COSTCL.SN","Healthcare, Consumer Cyclical, Consumer Defensive, Technology"
9417bc61-9ba5-404c-a7a4-a1a694aa4f60,"Stock Market Action Plan: Fed Meeting, Nvidia AI Conference — The stock market remains in a correction. The Federal Reserve meeting and Nvidia's AI conference highlight the coming week.",,https://www.investors.com/research/investing-action-plan/stock-market-action-plan-fed-meeting-nvidia-ai-conference/?src=A00220&yptr=yahoo,finance.yahoo.com,2025-03-14T22:13:17.000000Z,"BZUN, NVDA, JD, MU, PDD, STMP, EVER, BRKB.BA, BRKBD.BA, BRKBB.BA","Consumer Cyclical, Technology, Communication Services"
bbebcc13-eaa1-48bd-aa0a-290de35de434,Nasdaq rally: Nvidia among winners in index’s strongest day in 4 months — Here are Nasdaq's top winning stocks in its best session since the November elections. Read more here.,,https://seekingalpha.com/news/4420928-nasdaq-rally-nvidia-among-winners-in-indexs-strongest-day-in-4-months,seekingalpha.com,2025-03-14T21:43:22.000000Z,NVDA,Technology
1a54a290-6794-4deb-8a56-3fe010cdbfaa,"Market Recap: Stocks Rebound Sharply on Friday, March 14, 2025 — In a dramatic turnaround, U.S. stocks rebounded sharply on Friday, March 14, 2025, marking their best performance of the year. This rally came after a",,https://thestockmarketwatch.com/stock-market-news/market-recap-stocks-rebound-sharply-on-friday-march-14-2025/49040/,thestockmarketwatch.com,2025-03-14T21:28:37.000000Z,"AAPL, NVDA, MSFT, TSLA","Technology, Consumer Cyclical"
78b7bddd-5313-4b54-806a-a3028fa54d8d,"Advanced Micro Devices, Inc. (AMD) Eyes Strong AI-Driven Growth in 2025 Amid Rising Data Center Demand — We recently published a list of 10 AI Stocks On Wall Street’s Radar. In this article, we are going to take a look at where Advanced Micro Devices, Inc.",,https://www.insidermonkey.com/blog/advanced-micro-devices-inc-amd-eyes-strong-ai-driven-growth-in-2025-amid-rising-data-center-demand-1482267/,insidermonkey.com,2025-03-14T20:20:38.000000Z,"AMD.MX, AMD, A1MD34.SA, AMD.DE",Technology
09e5611c-f701-4899-99df-300955443902,"Broader US stock indices close higher on day, but still down for the 4th consecutive week — S&P and NASDAQ index surge by 2.1% in 2.6% respectively",,https://www.forexlive.com/stock-market-update/broader-us-stock-indices-close-higher-but-still-down-for-the-fourth-consecutive-week-20250314/,forexlive.com,2025-03-14T20:16:06.000000Z,"AAPL, GOOGL, NVDA, MSFT, TSLA","Technology, Communication Services, Consumer Cyclical"
c30345ab-b2b1-489a-80f3-954532f7f36b,Palantir Leads AI Stock Rebound From Tariff Rout — Palantir Technologies led a rally in AI stocks on Friday as markets rebounded after slumping into a correction on Thursday.,,https://www.investopedia.com/palantir-leads-ai-stock-rebound-from-tariff-rout-11697318,investopedia.com,2025-03-14T20:05:43.000000Z,"NVDA, SMCI, APP",Technology
89e15d00-27a0-4448-9957-06487ad13737,"Gold Miners Thrive Amid Soaring Gold Prices and Production Gains — Market Analysis by  covering: S&P 500, NVIDIA Corporation, Barrick Gold Corp, Agnico Eagle Mines Limited. Read 's Market Analysis on Investing.com",,https://www.investing.com/analysis/gold-miners-thrive-amid-soaring-gold-prices-and-production-gains-200658338,investing.com,2025-03-14T19:47:00.000000Z,"NVDA, AU, GOLD, NEM, HL, IAG, HL-PB, EPOR, CELTF, PMNXF, NCMGY, NCMGF, AULGF, GBGD, EDVGF","Technology, Basic Materials, Financial Services, Consumer Defensive"
f8a2af12-bd75-4be7-b3ce-9617df5ad0ef,How American Billionaires Have Lost $400 Billion Since Trump’s Inauguration — Expectations were that billionaires would be the big winners in a Trump America 2.0. Instead their fortunes have plummeted in the first eight weeks. Here are the biggest losers.,,https://www.forbes.com/sites/gracethomas/2025/03/14/heres-how-much-american-billionaires-have-lost-since-trumps-inauguration/,forbes.com,2025-03-14T16:42:03.000000Z,"AAPL, GOOGL, NVDA, MSFT, TSLA","Technology, Communication Services, Consumer Cyclical"
823128f3-2cf7-493d-bfc0-2c251342b131,"US stock market today: Market rebound - S&P 500 jumps 1.8%, Dow up 1.5%, Nasdaq surges 2.4%, but $5 trillion lost in 3 weeks amid Trump’s tariffs and inflation concerns — Stock market volatility continues as Dow, S&P 500, and Nasdaq make a sharp recovery after steep weekly losses. The S&P 500 rebounded 1.8% after falling into correction territory, while the Dow Jones climbed 1.5% and the Nasdaq Composite surged 2.4%. Investor sentiment improved after Senate leader Chuck Schumer backed a funding bill, reducing government shutdown fears. However, concerns remain over Trumps tariff policies, rising inflation, and falling consumer confidence, which dropped to 57.9, missing expectations. As the Federal Reserve meeting approaches, markets watch for interest rate signals that could shape the coming weeks.",,https://economictimes.indiatimes.com/news/international/us/us-stock-market-today-market-rebound-sp-500-jumps-1-8-dow-up-1-5-nasdaq-surges-2-4-but-5-trillion-lost-in-3-weeks-amid-trumps-tariffs-and-inflation-concerns/articleshow/119018371.cms,economictimes.indiatimes.com,2025-03-14T16:40:06.000000Z,"AAPL, NVDA, TSLA, NFLX","Technology, Consumer Cyclical, Communication Services"
cf1c36af-ca2d-4698-a8e6-f7082670ad94,Advanced Micro Devices's Options Frenzy: What You Need to Know - Advanced Micro Devices (NASDAQ:AMD),,https://www.benzinga.com/insights/options/25/03/44331948/advanced-micro-devicess-options-frenzy-what-you-need-to-know,benzinga.com,2025-03-14T15:01:36.000000Z,"AMD, SONY",Technology
04afdfc7-cf48-45fd-b35f-03c0299da178,Leverage Shares by Themes Expands Lineup and Enters Cryptocurrency Space with the Launch of a 2X Long Single-Stock ETF Tracking Coinbase (Ticker: COIG) — **media[566683]**,,https://www.manilatimes.net/2025/03/14/tmt-newswire/globenewswire/leverage-shares-by-themes-expands-lineup-and-enters-cryptocurrency-space-with-the-launch-of-a-2x-long-single-stock-etf-tracking-coinbase-ticker-coig/2073513,manilatimes.net,2025-03-14T14:06:28.000000Z,"NVDA, TSLA","Technology, Consumer Cyclical"
c079c96d-be23-48e9-83b2-69dce39f1f3e,"Zacks Market Edge Highlights: Tesla, NVIDIA, JPMorgan Chase, Exxon Mobil and Novo Nordisk — Tesla, NVIDIA, JPMorgan Chase, Exxon Mobil and Novo Nordisk are part of the Zacks Market Edge blog.",,https://www.zacks.com/stock/news/2430284/zacks-market-edge-highlights-tesla-nvidia-jpmorgan-chase-exxon-mobil-and-novo-nordisk?cid=CS-ZC-FT-press_releases-2430284,zacks.com,2025-03-14T13:49:00.000000Z,"NVDA, TSLA, XOM, JPM","Technology, Consumer Cyclical, Energy, Financial Services"
465052f7-0110-49fd-a053-1b71fb528e9a,"Futures, Yields, Gold All Jump After Schumer Caves To Keep Government Open — ZeroHedge - On a long enough timeline, the survival rate for everyone drops to zero",,https://www.zerohedge.com/markets/futures-yields-gold-all-jump-after-schumer-caves-keep-government-open,zerohedge.com,2025-03-14T12:17:13.000000Z,"AAPL, GOOGL, ULTA, NVDA, MSFT, SMTC, DOCU, GOGO, TSLA, PTON, GNDCN.MX, AAOI, 399300.SZ, RKN.AX, ^AXJO, ^HSI, 000300.SS, ^JI0020.JO, ^N225, USDJPY, ^FCHI","Technology, Communication Services, Consumer Cyclical"
12ddb00b-ba81-4019-9c31-0492777a224f,"Tech's 3-week selloff, led by Tesla, wipes out $2.7 trillion in value from megacaps — Wall Street had very different expectations for the tech trade following President Trump's election victory in November.",,https://www.cnbc.com/2025/03/14/techs-3-week-selloff-wipes-out-2point7-trillion-in-value-from-megacaps.html,cnbc.com,2025-03-14T11:00:01.000000Z,"AAPL, GOOGL, NVDA, MSFT, TSLA","Technology, Communication Services, Consumer Cyclical"
29cace49-35a8-4b09-a503-3cb4081a93b8,What are retail traders telling us? — A look at how mom-and-pop investors are trading in the current market,,https://www.ft.com/content/a996b247-d315-40f6-9689-33d872a2a366,ft.com,2025-03-14T06:30:14.000000Z,"IBKR, NVDA, TSLA","Financial Services, Technology, Consumer Cyclical"
24a5a923-0116-41ce-8ee3-dad8a439602e,"Intel shares jump 15% following new CEO appointment — Lip-Bu Tan will assume the role of CEO on March 18, 2025.",,https://www.thehindubusinessline.com/info-tech/intel-shares-jump-15-following-new-ceo-appointment/article69328839.ece,thehindubusinessline.com,2025-03-14T04:15:09.000000Z,"NVDA.MI, AAPL, AMD, AVGO, AVGOP, CDNS, SNPS, AAPL.BA, NVDAD.BA, QCOMD.BA, AAPLD.BA, QCOMC.BA, INTCD.BA, NVDAC.BA, AVGO.BA, AVGOD.BA, AAPLC.BA, AAPLCL.SN, AAPL.SN, INTCCL.SN, AAPL.NE, APC.DE, AMD.DE, SYP.DE, CDS.DE, 1YD.DE, AAPL.MX, AMD.MX, CDNS.MX, AVGO.MX, 0LBP.L, 0YXG.L, 0HS2.L, AVGO34.SA, A1MD34.SA, S1NP34.SA",Technology
1e0f0fbe-b375-49c1-ac88-6e59a875527c,"2025 Tech Stock Market — Impending Recession or Just a Wild Ride? — The technology sector, encompassing software, hardware, semiconductors, artificial intelligence, and cloud computing, remains a pivotal component of the global equity market. Major indices such as…",,https://medium.com/@nouhaelhariri78/2025-tech-stock-market-impending-recession-or-just-a-wild-ride-e27cda69f46a,medium.com,2025-03-13T23:11:43.000000Z,"AAPL, GOOGL, AVGO, AVGOP, NVDA, MSFT, ON, TSLA","Technology, Communication Services, Consumer Cyclical"
cfb10b82-4358-4ec0-a85d-8633f6c07190,"Intel Rallies After Naming Chip Veteran Lip-Bu Tan as CEO — (Bloomberg) -- Shares of Intel Corp. jumped 15% after the company named Lip-Bu Tan as its next chief executive officer, entrusting a former board member and semiconductor veteran with one of the toughest jobs in the chip industry. Most Read from BloombergTrump DEI Purge Hits Affordable Housing GroupsElectric Construction Equipment Promises a Quiet RevolutionNYC Congestion Pricing Toll Gains Support Among City ResidentsOpen Philanthropy Launches $120 Million Fund To Support YIMBY ReformsProspect",,https://finance.yahoo.com/news/intel-names-chip-industry-veteran-204753745.html,finance.yahoo.com,2025-03-13T22:24:15.000000Z,"AVGO34.SA, A1MD34.SA, S1NP34.SA, NVDA.MI, AAPL, AMD, AVGO, AVGOP, CDNS, SNPS, AAPL.BA, NVDAD.BA, QCOMD.BA, AAPLD.BA, QCOMC.BA, INTCD.BA, NVDAC.BA, AVGO.BA, AVGOD.BA, AAPLC.BA, AAPLCL.SN, AAPL.SN, INTCCL.SN, AAPL.NE, APC.DE, AMD.DE, AAPL.MX, AMD.MX, CDNS.MX, AVGO.MX, 0LBP.L, 0YXG.L, 0HS2.L",Technology
767afda4-c0ae-4ed4-8e41-72d3fc0dc9b3,"US Stocks Fall as Trump Threatens Tariffs on EU Goods — US stock markets faced significant sell-offs amid concerns over potential tariffs on French champagne and EU spirits, proposed by former President Trump. The Do",,https://www.gurufocus.com/news/2738299/us-stocks-fall-as-trump-threatens-tariffs-on-eu-goods,gurufocus.com,2025-03-13T22:00:17.000000Z,"AAPL, NVDA, TSLA","Technology, Consumer Cyclical"
8ae2b963-36b3-4a84-a9f2-b06d4911f3d2,"Nvidia Could Be Joining Intel After All (NASDAQ:INTC) — Explore Intel's investment potential amid U.S. semiconductor strategies, market challenges, and a rumored AMD-TSMC joint venture offering revitalization, along with a new CEO.",,https://seekingalpha.com/article/4767396-nvidia-could-be-joining-intel-after-all,seekingalpha.com,2025-03-13T21:52:28.000000Z,"NVDA, INTC, ON",Technology
5d50c9c7-e862-4a87-84a0-fd72fd77c4d1,"Market Recap: S&P 500 Enters Correction Territory Amid Trade War Escalation — On Thursday, March 13, 2025, Wall Street experienced a significant sell-off, with the S&P 500 officially entering correction territory. The market's",,https://thestockmarketwatch.com/stock-market-news/market-recap-sp-500-enters-correction-territory-amid-trade-war-escalation/49032/,thestockmarketwatch.com,2025-03-13T21:28:41.000000Z,"NVDA.BA, AVGO.BA, AVGOD.BA, ADBE, AVGO, AVGOP, NVDA, NVD.DE, 1YD.DE, ADB.DE, NVDA.MX, ADBE.MX, AVGO.MX, 0YXG.L, ADBE34.SA, AVGO34.SA, NVDC34.SA",Technology
e3f51206-2d8b-480e-bdad-e2d69cbf4e34,NVIDIA's Options: A Look at What the Big Money is Thinking - NVIDIA (NASDAQ:NVDA),,https://www.benzinga.com/insights/options/25/03/44316218/nvidias-options-a-look-at-what-the-big-money-is-thinking,benzinga.com,2025-03-13T20:17:48.000000Z,"NVDA.MI, NVDAD.BA, NVDAC.BA, MSCL.SN, NVDA",Technology
998c9ff5-77ed-4f06-9914-0d6775aef1c6,"INTC stock price surges over 15%: Could new Intel CEO Lip-Bu Tan turn the struggling chipmaker’s fortunes? — Tan will have work to do, as Intel has lost much of its market share after missing the AI boom, but INTC stock is up on the news.",,https://www.fastcompany.com/91297456/intc-intel-stock-price-can-new-ceo-lip-bu-tan-save-the-struggling-ai-artificial-intelligence-chip-maker?partner=rss&amp;utm_source=rss&amp;utm_medium=feed&amp;utm_campaign=rss+fastcompany&amp;utm_content=rss,fastcompany.com,2025-03-13T17:30:00.000000Z,"INTC.MX, INTC, INCO.BR, INTC.SN, INL.DE",Technology
9f3aed88-af50-46fd-8438-0e6a1149e3dc,AMD Stock: Can the PC Refresh Cycle Spark a Rally? — Stocks Analysis by MarketBeat.com (Leo Miller) covering: Advanced Micro Devices Inc. Read MarketBeat.com (Leo Miller)'s latest article on Investing.com,,https://www.investing.com/analysis/amd-stock-can-the-pc-refresh-cycle-spark-a-rally-200658290,investing.com,2025-03-13T16:32:00.000000Z,"AMD, NVDA, INTC, DELL, AMD.DE, NVD.DE, INL.DE, AMD.MX, INTC.MX, NVDA.MX, INCO.BR, NVDC34.SA, A1MD34.SA, NVDA.BA, INTC.SN",Technology
a1e34491-2eae-45a1-bd9c-d12aa7ea30f4,"US stock market today: Market in fall again - Dow Jones, Nasdaq, S&P 500 drop amid Trump’s tariff threats, inflation data, and U.S. government shutdown concerns — US stock market today: Dow, S&P 500, and Nasdaq dropped as Trump's tariff threats and a looming U.S. government shutdown unsettled investors. The Dow fell 0.31% to 41,223.97, while the Nasdaq and S&P 500 also declined. Meanwhile, inflation data showed a stable Producer Price Index, sparking hopes for Federal Reserve rate cuts. However, uncertainty over a 200% tariff on EU wines and spirits and Senate Democrats blocking a spending bill added to market jitters. With volatility rising, investors are watching the Feds next move and political developments closely.",,https://economictimes.indiatimes.com/news/international/us/stock-market-today-dow-nasdaq-sp500-drop-trump-tariff-inflation/articleshow/118983232.cms,economictimes.indiatimes.com,2025-03-13T16:01:37.000000Z,"NVDA, TSLA","Technology, Consumer Cyclical"
23706c26-f33d-495b-a882-ec6d063936bc,"The Zacks Analyst Blog Highlights Taiwan Semiconductor Manufacturing, NVIDIA, Intuit and S&P Global — Taiwan Semiconductor Manufacturing, NVIDIA, Intuit and S&P Global are part of the Zacks top Analyst Blog.",,https://www.zacks.com/stock/news/2429811/the-zacks-analyst-blog-highlights-taiwan-semiconductor-manufacturing-nvidia-intuit-and-sp-global?cid=CS-ZC-FT-press_releases-2429811,zacks.com,2025-03-13T14:48:00.000000Z,"NVDA, INTU, SPGI","Technology, Financial Services"
