id,text,y,url,source,published_at,symbols,industries
e0212df9-6996-4546-b366-f34e4e928a62,"Stock Market Today: Major Indexes Hit Record Highs as June Ends with Strong Rally — The U.S. stock market closed at record highs on Monday, June 30, 2025, as optimism around global trade talks and strong economic indicators propelled major",,https://thestockmarketwatch.com/stock-market-news/stock-market-today-major-indexes-hit-record-highs-as-june-ends-with-strong-rally/50218/,thestockmarketwatch.com,2025-06-30T21:49:00.000000Z,"AMZN.MX, AAPL.MX, GOOGL.MX, GOOG.MX, NVDA.MX, AAPL, AMZN, GOOG, GOOGL, NVDA, MSFT, TSLA, NVDC34.SA, AAPL.BA, GOOGL.BA, NVDA.BA, AAPLD.BA, GOGLD.BA, AAPLC.BA, AMZN.SN, GOOGL.SN, AAPLCL.SN, AAPL.SN, GOOG.SN, AMZNCL.SN, GOOGCL.SN, AAPL.NE, AMZ.DE, APC.DE, ABEA.DE, NVD.DE, ABEC.DE","Consumer Cyclical, Technology, Communication Services"
a3bb2746-6f88-4de0-9f0b-30b5067c41d6,IREN Achieves Mid-Year Target of 50 EH/s — Establishes Global Leadership in Efficient Bitcoin Mining,,https://www.manilatimes.net/2025/07/01/tmt-newswire/globenewswire/iren-achieves-mid-year-target-of-50-ehs/2141239,manilatimes.net,2025-06-30T21:40:20.000000Z,NVDA,Technology
8a90227e-0f00-4eb1-82dc-def3fc2d125d,NVIDIA Corporation (NVDA) Set To Hit $4 Trillion Market Cap — NVIDIA Corporation (NASDAQ:NVDA) is among the 13 Best Big Name Stocks to Buy Now.,,https://www.insidermonkey.com/blog/nvidia-corporation-nvda-set-to-hit-4-trillion-market-cap-1560786/,insidermonkey.com,2025-06-30T21:11:14.000000Z,"NVDA, NVDC34.SA, NVDA.BA, NVD.DE, NVDA.MX",Technology
f8bdb2dc-623b-465f-a79e-86da45c5fa2a,"S&P 500 to 6,500: Why All-Time Highs Aren’t a Top — Market Analysis by  covering: S&P 500, Dow Jones Industrial Average, Microsoft Corporation, Apple Inc. Read 's Market Analysis on Investing.com",,https://www.investing.com/analysis/sp-500-to-6500-why-alltime-highs-arent-a-top-200662989,investing.com,2025-06-30T20:47:00.000000Z,"AAPL, AMZN, AMD, NVDA, MSFT, AMZ.DE, AMD.DE, AMZN.MX, AMD.MX, A1MD34.SA, AMZN.SN, AMZNCL.SN","Technology, Consumer Cyclical"
770211c6-ddfe-4d98-aaef-785387e53add,"Advanced Micro Devices shares snap six-session winning streak (NASDAQ:AMD) — AMD stock slips after six days of gains but remains up 26% this month. Analysts highlight growth in AI and GPU markets, deeming AMD undervalued.",,https://seekingalpha.com/news/4463948-advanced-micro-devices-shares-snap-six-session-winning-streak,seekingalpha.com,2025-06-30T18:52:41.000000Z,AMD,Technology
8346e53f-c950-479c-b555-5eb705c7b0e3,5 Best Undervalued Stocks To Buy For July 2025 — Looking for undervalued stocks? We identified the top undervalued stocks in July 2025. Check out the list here.,,https://www.forbes.com/sites/investor-hub/article/best-undervalued-stocks-to-buy-july-2025/,forbes.com,2025-06-30T18:28:09.000000Z,"INL.DE, CCC3.DE, PFE.DE, INTC.MX, PFE.MX, KO.MX, INTC, KO, PFE, PFE-WI, JNJ, INCO.BR, COCA34.SA, DJNJ2.BA, DJNJ3.BA, PFED.BA, BRKB.BA, BRKBD.BA, BRKBB.BA, INTC.SN, KO.SN, PFECL.SN, PFE.SN","Technology, Consumer Defensive, Healthcare"
8b1ca7d0-4c27-4a0b-b555-ceba24a6fc45,"Jim Cramer Says NVIDIA is “Truly Unassailable” — NVIDIA Corporation (NASDAQ:NVDA) is one of the 11 stocks that Jim Cramer recently commented on. The company was mentioned during the episode, and here’s what Mad Money’s host had to say: “It seems so easy now, if you wanted to make money in NVIDIA, all you had to do was hold the stock, and you […]",,https://finance.yahoo.com/news/jim-cramer-says-nvidia-truly-160118723.html,finance.yahoo.com,2025-06-30T16:01:18.000000Z,"NVDA, NVDC34.SA, NVDA.BA, NVD.DE, NVDA.MX",Technology
54fcb5b2-2140-42ca-a46c-c1b12258f25f,"US stock market today: Dow, S&P 500, Nasdaq hit all-time highs as June ends with a bang — trade truce, Fed rate cut hopes, and tech rally fuel Wall Street surge — US stock market today show Wall Street gaining momentum as June ends, with the Dow Jones rising 150 points and the S&P 500 hitting new records. Investors are upbeat after President Donald Trump took a strong stance on trade and Canada reversed its planned tax on US tech companies. Hopes for fresh trade deals are pushing markets higher. With the Nasdaq also ticking up, this marks the second straight winning month for US stocks. As talks resume and Trump leads negotiations, investors are eyeing a strong start to July. Dont miss whats next in this market comeback.",,https://economictimes.indiatimes.com/news/international/us/us-stock-market-today-dow-sp-500-nasdaq-hit-all-time-highs-as-june-ends-with-a-bang-trade-truce-fed-rate-cut-hopes-and-tech-rally-fuel-wall-street-surge/articleshow/122163720.cms,economictimes.indiatimes.com,2025-06-30T15:20:45.000000Z,"AAPL, AVGO, AVGOP, NVDA",Technology
d584b687-1378-4ef7-a4ee-f5c0b56d34e5,"Here is What to Know Beyond Why Intel Corporation (INTC) is a Trending Stock — Zacks.com users have recently been watching Intel (INTC) quite a bit. Thus, it is worth knowing the facts that could determine the stock's prospects.",,https://www.zacks.com/stock/news/2557560/here-is-what-to-know-beyond-why-intel-corporation-intc-is-a-trending-stock?cid=CS-ZC-FT-tale_of_the_tape|most_searched_stocks-2557560,zacks.com,2025-06-30T13:00:04.000000Z,"INL.DE, INTC, INTC.MX, INCO.BR, INTC.SN",Technology
77e69f77-7080-44b7-93e5-136f010633e4,"Futures Push Higher Into Record Territory Amid Trade Talk Progress — ZeroHedge - On a long enough timeline, the survival rate for everyone drops to zero",,https://www.zerohedge.com/markets/futures-push-higher-record-territory-amid-trade-talk-progress,zerohedge.com,2025-06-30T12:36:32.000000Z,"TSLA, MRNA, MTU, ^N225, USDCNY, USDJPY, EURUSD, YI, ^FCHI, AAPL, GOOGL, NVDA, MSFT, MRNA.MX, 0A45.L, 0K1Y.L, 1ST.AX, RDM.AX, ^AXJO, M1RN34.SA, BNP.MI, MSFT.MI, NVDA.MI, STM.MI","Consumer Cyclical, Healthcare, Technology, Communication Services, Basic Materials, Financial Services"
2c0deab2-55b9-4712-b324-8da43adf1eec,Billionaire Bill Gates Has 66% of His Foundation's $45 Billion Portfolio Invested in 3 Outstanding Stocks — The Gates Foundation portfolio is a mix of Gates' tech background and influence from one of the greatest investors of all time.,,https://finance.yahoo.com/news/billionaire-bill-gates-66-foundations-223500823.html,finance.yahoo.com,2025-06-29T22:35:00.000000Z,"BRKB.BA, BRKBD.BA, BRKBB.BA, NVDA, MSFT, NFLX, SRCL, BRK-B, BRK-A, WM","Technology, Communication Services, Industrials, Financial Services"
89737fd4-97d1-4821-b919-1e4f6d4b8505,"Live updates: Wall Street rallies to a new record high as fears recede, ASX likely to open flat — US investors continue their rush back to risk, driving Wall Street to a new record high, but the ASX is not tipped to follow. Follow the day's events and insights from our business reporters on the ABC News live markets blog.",,https://www.abc.net.au/news/2025-06-30/asx-markets-business-news-live-updates/105474826,abc.net.au,2025-06-29T21:14:05.000000Z,"NVDA, MSFT, MSFT.MI, NVDA.MI",Technology
20db8e90-d5b4-4c74-a022-377eec4453a7,"Don’t Lose Sight of the Bigger Picture — In early June, I sent a research note to my Educational Members. Since then, it's been highlighted on Fox Business: https://www.foxbusiness.com/video/6374823459112 and on Jim Cramer's Mad Money show: https://www.youtube.com/watch?v=SfR3nbnIV98. I summarize my key themes in the following 9 points:It’s easy to get caught up in the day-to-day market noise,",,https://joefahmy.com/2025/06/29/dont-lose-sight-of-the-bigger-picture,joefahmy.com,2025-06-29T18:12:12.000000Z,NVDA,Technology
3482b8c1-fd46-461c-b8ae-ffe823fb6fc3,"Consumer Tech News (June 23–June 27): Inflation Stirs, Trade Tensions Flare, And Big Tech Makes Big Moves - Apple (NASDAQ:AAPL), Amazon.com (NASDAQ:AMZN)",,https://www.benzinga.com/markets/large-cap/25/06/46159694/consumer-tech-news-june-23-june-27-inflation-stirs-trade-tensions-flare-and-big-tech-makes-big-,benzinga.com,2025-06-29T16:17:39.000000Z,"F.SW, NVDC34.SA, GMCO34.SA, TSLA34.SA, AAPL, AMZN, GOOG, GOOGL, NVDA, MSFT, MSFT.MI, TSLA, F, GM, FDS, AAPL.BA, GOOGL.BA, NVDA.BA, TSLAD.BA, MSFTD.BA, AAPLD.BA, MSFTB.BA, MSFTC.BA, TSLAC.BA, GOGLD.BA, AAPLC.BA, AMZN.SN, MSFT.SN, GOOGL.SN, AAPLCL.SN, MSFTCL.SN, AAPL.SN, GOOG.SN, AMZNCL.SN, GOOGCL.SN, 9984.T, SFTBY, XIACY, SFTBF, AAPL.NE, AMZ.DE, APC.DE, ABEA.DE, NVD.DE, TL0.DE, MSF.DE, 8GM.DE, ABEC.DE, FMC1.DE, AMZN.MX, AAPL.MX, GOOGL.MX, GOOG.MX, MSFT.MX, NVDA.MX, F.MX, GM.MX, TSLA.MX, SOFTN.MX, FDS.MX, 0L7L.L, MSF.BR","Consumer Cyclical, Technology, Communication Services, Financial Services"
86f5588a-60e4-4cd8-8cf3-572c0cef4377,"Trump’s NASDAQ Up 5.2% In First Half After Biden’s 18% 2024 Pop — Tariffs, uncertainty, and inflation crimped stocks in first half of 2025 after AI frenzy and strong earnings sent Nasdaq up 18% in 2024. Bet on companies Trump favors.",,https://www.forbes.com/sites/petercohan/2025/06/29/trumps-nasdaq-up-52-in-first-half-after-bidens-18-2024-pop/,forbes.com,2025-06-29T13:58:19.000000Z,"NVDA, MRNA","Technology, Healthcare"
f0f0000e-d69d-4e27-81b1-0621cb7fc358,"Market at Extremes as Volatility Vanishes and Nvidia Runs Hot — Markets enter a short yet data-packed week dangerously overbought, driven by Nvidia’s relentless climb despite tightening liquidity conditions. With implied volatility suspiciously low ahead of critical economic data and rising trade rhetoric, investors may be underestimating potential turbulence. Meanwhile, gold’s breakdown could signal deeper trouble ahead.",,https://mottcapitalmanagement.com/market-at-extremes-as-volatility-vanishes-and-nvidia-runs-hot/,mottcapitalmanagement.com,2025-06-29T12:47:51.000000Z,NVDA,Technology
5ed6bdb1-1c0f-463b-ac9d-77ec0eb53c5f,"Intel Is A Buy (Technical Analysis) (NASDAQ:INTC) — Intel shows bullish technicals, smart money accumulation, and turnaround momentum under new leadership with key AI catalysts. Find out why INTC stock is a buy.",,https://seekingalpha.com/article/4798071-intel-buy-technical-analysis,seekingalpha.com,2025-06-29T11:26:35.000000Z,"INTC, INTC.SN, INL.DE, INTC.MX, INCO.BR",Technology
947de9dc-b805-456a-b782-7bc1a2274c26,"US Stock Market Eyes Fed Rate Cuts Amid Trade Negotiations — The US stock market showed strong performance, with the Nasdaq and S&P 500 reaching new highs, driven by easing Middle East tensions and detailed US-China trade",,https://www.gurufocus.com/news/2951687/us-stock-market-eyes-fed-rate-cuts-amid-trade-negotiations,gurufocus.com,2025-06-29T05:30:13.000000Z,NVDA,Technology
151a2714-d5cc-4f4d-97fd-93ebc7a9f191,"With a $3.8 Trillion Market Cap, Does Nvidia Really Still Have Room to Grow? — Nvidia is the largest publicly traded company in the market, but that doesn’t mean it can’t still produce strong returns.  Nvidia’s capital allocation could drive returns over the long term.  Nvidia (NASDAQ: NVDA) is the largest publicly traded company, with a market cap of about $3.8 trillion on Friday afternoon, and a stock price that's just below its all-time high.",,https://finance.yahoo.com/news/3-8-trillion-market-cap-222200730.html,finance.yahoo.com,2025-06-28T22:22:00.000000Z,NVDA,Technology
6848f23c-5be2-4b5e-9f54-5438a4bf4816,"The record-breaking week in the stock market that could have gone very badly — Incredible as that was, this week could have easily went another way.",,https://www.cnbc.com/2025/06/28/the-record-breaking-week-in-the-stock-market-that-could-have-gone-very-badly.html,cnbc.com,2025-06-28T20:28:48.000000Z,"AAPL, AVGO, AVGOP, NVDA, CSCO, ABT, NVDA.MI, ABT.SN, ABTCL.SN, MSCL.SN","Technology, Healthcare"
ff4878ca-ccad-4d0a-b951-fba92d433705,"Stock Market Hits New Highs in 2025: A Mid-Year Wrap-Up — As we reach the midpoint of 2025, the U.S. stock market tells a tale of resilience, volatility, and evolving narratives that have kept investors on their",,https://thestockmarketwatch.com/stock-market-news/stock-market-hits-new-highs-in-2025-a-mid-year-wrap-up/50199/,thestockmarketwatch.com,2025-06-28T16:47:46.000000Z,"AAPL, GOOGL, NVDA, MSFT, TSLA","Technology, Communication Services, Consumer Cyclical"
1833757d-eb31-44b9-9ac9-54cd00466bbd,"AMD (AMD) Upgraded by Analysts on Inferencing Potential — Summary:
    Melius Research upgrades Advanced Micro Devices (AMD) to a ""Buy"" rating with a boosted price target of $175, driven by robust GPU demand projection",,https://www.gurufocus.com/news/2951553/amd-amd-upgraded-by-analysts-on-inferencing-potential,gurufocus.com,2025-06-28T14:55:18.000000Z,"AMD, AMD.DE, AMD.MX, A1MD34.SA",Technology
4102ea8c-bb64-4768-acc9-58b7982614d7,"Nvidia: The Music Is About To Stop (NASDAQ:NVDA) — Nvidia Corporation faces macro risks, rising competition, and potential demand slowdown. Click for our updated look at NVDA stock and why we remain bearish.",,https://seekingalpha.com/article/4797785-nvidia-the-music-is-about-to-stop,seekingalpha.com,2025-06-28T14:00:00.000000Z,"NVDA, NVDC34.SA, NVDA.BA, NVD.DE, NVDA.MX",Technology
73d43594-134b-40c1-bae0-7eb1e95f2101,"Today’s Top Tech & AI News at a Glance — June 28, 2025 — OpenAI turns to Google’s AI chips to power its products
Summary: OpenAI is renting Google’s TPUs from Google Cloud to support ChatGPT and other services — marking a first major shift from Nvidia…",,https://medium.com/simpletechdose/todays-top-tech-ai-news-at-a-glance-june-28-2025-7984066ce7d5,medium.com,2025-06-28T13:39:27.000000Z,"NVDA, MSFT",Technology
446fd92d-4c90-4653-834c-6bc5f7354b8e,"S&P 500 Hits New Record High — The S&P 500 (SPX) reached a record high of 6,173.07, gaining 0.52%, while the Nasdaq Composite (COMP) hit 20,273.46, up more than 105 points, and the Dow Jones Industrial Average (DJI) rose 432.43 points, or 1%, to 43,819.27, despite volatile U.S.-Canada trade talk developments. A recovery in the artificial intelligence…",,https://wallstreetpit.com/127768-sp-500-hits-new-record-high/,wallstreetpit.com,2025-06-28T13:19:29.000000Z,"NVDA, MSFT",Technology
94d60a82-3b0f-4072-9d4c-e9029e4f5aac,"Benzinga Bulls And Bears: Nvidia, Micron, HIMS — And Markets Soar On Mideast And Tariff Relief Benzinga Bulls And Bears: Nvidia, Micron, HIMS — And Markets Soar On Mideast And Tariff Relief — Benzinga examined the prospects for many investors' favorite stocks over the last week — here's a look at some of our top stories.",,https://www.benzinga.com/markets/market-summary/25/06/46157190/benzinga-bulls-and-bears-nvidia-micron-hims-and-markets-soar-on-mideast-and-tariff-relief,benzinga.com,2025-06-28T12:00:31.000000Z,"AVAV, NVDA, MSFT, MU, CNXC, PLTR, HIMS, HIMS-WT, MTE.DE, PTX.DE, ASTS, ASTSW, ALT, MU.MX, ALT1.MX, 0A4C.L, 0A7R.L, MUTC34.SA, NVDA.MI, NVDAD.BA, NVDAC.BA","Industrials, Technology, Consumer Defensive, Healthcare"
1169547b-939c-496b-8c6c-4955fd1c7b0b,"US stocks hit record highs, post weekly gains of over 3% — US stocks hit record highs, post weekly gains of over 3%",,https://www.argaam.com/en/reports/international_market_daily_report/50157?preview=true,argaam.com,2025-06-28T10:32:00.000000Z,"^FCHI, NVDA, ^N225",Technology
7592e144-b61c-4e78-8bbb-672beac48027,Cyngn Announces Strategic Collaboration With NVIDIA Corporation (NVDA) — NVIDIA Corporation (NASDAQ:NVDA) is one of the 13 Best Long Term Growth Stocks to Invest in Right Now.,,https://www.insidermonkey.com/blog/cyngn-announces-strategic-collaboration-with-nvidia-corporation-nvda-1559626/,insidermonkey.com,2025-06-28T08:52:46.000000Z,"NVDA, NVDA.BA, NVD.DE, NVDA.MX, NVDC34.SA",Technology
4e2bdeba-6602-4a2a-8c19-ae8f7399b9ff,"Black Coffee: Market Mayhem — It’s time to sit back, relax and enjoy a little joe … Welcome to another rousing edition of Black Coffee, your off-beat weekly round-up of what’s been going on in the world of money and personal finance. I hope everybody had a wonderful week. And with that, let’s get right to this week’s commentary, shall […]",,https://lenpenzo.com/blog/id88160-black-coffee-28-june-2025.html,lenpenzo.com,2025-06-28T08:00:02.000000Z,"AAPL, NVDA, MSFT, SBUX, PRCH, PRCHW, MSFT.MI, NVDA.MI, SBUX.MI","Technology, Consumer Cyclical"
2cfaeceb-a47b-4d60-a340-c5d328c92388,"S&P 500 hits record high after $10 trillion rally — Wall Street traders drive stocks to all-time highs amid tariff headlines, cooling West Asia risks, and US economic resilience.",,https://www.thehindubusinessline.com/markets/sp-500-hits-record-high-after-10-trillion-rally/article69747400.ece,thehindubusinessline.com,2025-06-28T04:40:59.000000Z,"JPMMV, JPMML, APC.DE, NKE.DE, RILY, RILYH, RILYP, RILYL, AAPL, NVDA, JPM, AAPL.MX, NKE, NKE.MX, NVDA.MI, AAPL.BA, NKE.BA, NVDAD.BA, NKED.BA, AAPLD.BA, NVDAC.BA, AAPLC.BA, JPMC.BA, NKE.SN, BACL.SN, AAPLCL.SN, NKECL.SN, AAPL.SN, JPMCL.SN, AAPL.NE","Financial Services, Technology, Consumer Cyclical"
07ea83ab-344a-4757-ab5d-3b9389061331,"Jim Cramer Warns Viewers About FOMO & Discusses These 19 Stocks — In a recent appearance on CNBC's Squawk on the Street, Jim Cramer discussed current market sentiment and robotics.",,https://www.insidermonkey.com/blog/jim-cramer-warns-viewers-about-fomo-discusses-these-19-stocks-1558736/,insidermonkey.com,2025-06-27T23:48:53.000000Z,"NVDA.MX, TSLA.MX, NVDA, TSLA, NVDC34.SA, TSLA34.SA, NVDA.MI, NVDA.BA, TSLAD.BA, TSLAC.BA, NVD.DE, TL0.DE","Technology, Consumer Cyclical"
70ac49f1-a2ce-47e7-ac78-ff2542723f11,"3 Stocks Hitting All-Time Highs With More Room to Run — Market Analysis by  covering: Microsoft Corporation, NVIDIA Corporation, DoorDash Inc, Roblox Corp. Read 's Market Analysis on Investing.com",,https://www.investing.com/analysis/3-stocks-hitting-alltime-highs-with-more-room-to-run-200662916,investing.com,2025-06-27T21:33:00.000000Z,"WFC, DASH.MX, DASH, RBLX, STQN, DROOF, MSF.BR, NVDA, MSFT, NVDA.MI, NVDAD.BA, NVDAC.BA, MSFT.SN, MSF.DE, MSFT.MX","Financial Services, Communication Services, Consumer Cyclical, Technology"
813b60b1-cba1-4eab-baf3-95a338c62aac,"ETF Tracker Newsletter For June 27, 2025 — ETF Tracker StatSheet           You can view the latest version here. MARKETS CLIMB THE WALL OF WORRY—BUT FOR HOW LONG? [Chart courtesy of MarketWatch.com] The markets kicked off the day riding yesterday’s momentum, with the S&P 500 reclaiming its February record. Optimism was fueled by hopes of progress on trade deals—especially after Commerce Secretary Lutnick confirmed a finalized trade framework ... Read More",,https://theetfbully.com/2025/06/etf-tracker-newsletter-for-june-27-2025/,theetfbully.com,2025-06-27T20:53:14.000000Z,"NVDA, MSFT",Technology
646e8bf6-f29c-4eea-b88f-8c7538097b6e,"Stock Market Today: S&P 500 and Nasdaq Hit Record Highs as Trade Optimism Grows — The S&P 500 and Nasdaq Composite both reached all-time highs in today's near the close market update, as investors cheered progress in U.S.-China trade",,https://thestockmarketwatch.com/stock-market-news/stock-market-today-sp-500-and-nasdaq-hit-record-highs-as-trade-optimism-grows/50191/,thestockmarketwatch.com,2025-06-27T19:16:04.000000Z,"AAPL, NVDA, MSFT, TSLA, ^N225, ^HSI","Technology, Consumer Cyclical"
9e9c7da5-92b1-47fa-8aa6-43dd1b15aa03,"Is QuantumScape Stock the Next NVIDIA, and Should You Buy It? — QS stock jumps 34.9% as its Cobra separator breakthrough fuels hopes for scalable solid-state EV battery production.",,https://www.zacks.com/stock/news/2556393/is-quantumscape-stock-the-next-nvidia-and-should-you-buy-it?cid=CS-ZC-FT-analyst_blog|investment_ideas-2556393,zacks.com,2025-06-27T19:00:00.000000Z,"NVDA, QS, QS-WT","Technology, Consumer Cyclical"
76a42a82-3dcd-44ff-99ea-8131832b835e,"3 forces driving a record week for stocks as 7 portfolio names hit new highs — The S&P 500 and Nasdaq Composite jumped to all-time highs Friday, a remarkable comeback from the dark days of April.",,https://www.cnbc.com/2025/06/27/3-forces-driving-a-record-week-for-stocks-as-7-portfolio-names-hit-highs.html,cnbc.com,2025-06-27T17:58:09.000000Z,"AVGO, AVGOP, NVDA, MSFT",Technology
1b34f4e4-2f33-4003-9d23-4af8e0e8315b,"Wall Street Roundup: Market Highs, Oil Whipsaw, Stablecoins — Oil whipsaw action in the face of global conflict. Market highs, tech upside. Stablecoin momentum.",,https://seekingalpha.com/article/4797839-wall-street-roundup-market-highs-oil-whipsaw-stablecoins,seekingalpha.com,2025-06-27T17:35:00.000000Z,"AAPL, AVGO, AVGOP, NVDA, NDAQ, BTCUSD, CC:BTC, NVDA.MI","Technology, Financial Services"
4d447c8a-1d5a-4dad-907d-541c2dcc765a,"'It's more likely they'll lose money': One strategist on why he's bearish on the AI trade — AI's potential for productivity gains may not translate into profits amid fierce competition, BCA's Peter Berezin told BI.",,https://finance.yahoo.com/news/more-likely-theyll-lose-money-173002751.html,finance.yahoo.com,2025-06-27T17:30:02.000000Z,NVDA,Technology
5371fe33-bbb2-4026-b659-a10140e8c56e,3 Ways To Profit With Big Tech Back In The Driver’s Seat — The technology sector has been leading the market rally off the early-April lows – with sizable double-digit gains piling up. Here are three ways you can profit.,,https://www.forbes.com/sites/moneyshow/2025/06/27/3-ways-to-profit-with-big-tech-back-in-the-drivers-seat/,forbes.com,2025-06-27T16:33:09.000000Z,"AAPL, AMD, GOOG, GOOGL, AMAT, META, AVGO, AVGOP, TSLA, AAPL.BA, GOOGL.BA, NVDAD.BA, TSLAD.BA, MSFTD.BA, AAPLD.BA, MSFTB.BA, MSFTC.BA, TSLAC.BA, NVDAC.BA, AVGO.BA, AVGOD.BA, GOGLD.BA, AAPLC.BA, GOOGL.SN, AAPLCL.SN, IWM.SN, MSFTCL.SN, AAPL.SN, GOOG.SN, GOOGCL.SN, AAPL.NE, IWM, SPY, APC.DE, AMD.DE, ABEA.DE, TL0.DE, ABEC.DE, ASMF.DE, 1YD.DE, AP2.DE, AAPL.MX, AMD.MX, GOOGL.MX, GOOG.MX, TSLA.MX, AMAT.MX, IWM.MX, AVGO.MX, 0KZC.L, 0YXG.L, 4336.HK, AVGO34.SA, TSLA34.SA, A1MD34.SA, A1MT34.SA, MSFT.MI, NVDA.MI","Technology, Communication Services, Consumer Cyclical"
92756b75-f2d9-4eb2-b092-93d80353aa5a,NVIDIA Deal Drives Autonomous Vehicle Stock Cyngn Inc. (NASDAQ: CYN) to Explosive Gains,,https://www.investorideas.com/news/2025/technology/06271Cyngn-CYN.asp,investorideas.com,2025-06-27T15:20:00.000000Z,NVDA,Technology
86b05b35-34b1-4ea6-a66c-3154c6a94d5c,"Headlines Today in Finance, Technology & Geopolitics — The Chips That Rule the World — Debt collectors are having a moment — and not in a feel-good way. Jefferson Capital, a company that buys up unpaid bills like credit cards, phone plans, and student loans, popped 26% in its Nasdaq…",,https://medium.com/@dwkim1212/headlines-today-in-finance-technology-geopolitics-the-chips-that-rule-the-world-7d2fd1fa0151,medium.com,2025-06-27T15:09:13.000000Z,"NVDA, MSFT",Technology
b0ecd3bd-4a82-44fb-9e04-26b5d841b3f9,"US stock market hits new record: S&P 500 live updates: All 3 indices hit record highs as Trump–China trade deal lifts Wall Street, AI stocks surge — S&P 500 record high headlines Fridays market rally as U.S. stocks soared on renewed trade deal hopes between President Donald Trump and China. The S&P 500 rose 0.4% to close at 6,168.60, topping its previous high from February. The Nasdaq Composite also hit a new record, while the Dow Jones gained 156 points. Investors were lifted by news of a finalized trade framework with China and talks with 10 more nations. AI stocks like Nvidia and Microsoft led the charge. Despite inflation rising slightly, markets stayed upbeat on expected Federal Reserve rate cuts and cooling global tensions.",,https://economictimes.indiatimes.com/news/international/us/us-stock-market-hits-new-record-sp-500-live-updates-all-3-indices-hit-record-highs-as-trumpchina-trade-deal-lifts-wall-street-ai-stocks-surge/articleshow/122115880.cms,economictimes.indiatimes.com,2025-06-27T14:48:11.000000Z,"BRKR, NVDA, MSFT, CNXC","Healthcare, Technology"
89d5b995-88a8-4465-b475-09b7de988e24,"The 4 forces that drove the stock market's latest record high — The S&P 500 hit a new record high on Friday, soaring to its highest level since February as investors cheered a host of bullish catalysts.",,https://www.businessinsider.com/stock-market-today-sp500-record-high-trump-fed-interest-rates-2025-6,businessinsider.com,2025-06-27T13:40:36.000000Z,NVDA,Technology
9410231b-5cf4-4d41-acd7-79396b5f3c1b,"NVIDIA (NVDA) Eyes $4 Trillion Market Cap Milestone Amid Rising AI Demand — Two years ago, NVIDIA Corporation (NVDA) made history as the first chipmaker to reach a market capitalization of $1 trillion. Now, it is on the verge of another",,https://www.gurufocus.com/news/2950022/nvidia-nvda-eyes-4-trillion-market-cap-milestone-amid-rising-ai-demand,gurufocus.com,2025-06-27T12:50:13.000000Z,"NVD.DE, NVDA, NVDA.MX, NVDC34.SA, NVDA.BA",Technology
298949a9-4bec-4883-a0e0-55a0d2e870fc,"S&P Futures Trade At All Time High Boosted By Trade Talks, Nike Results — ZeroHedge - On a long enough timeline, the survival rate for everyone drops to zero",,https://www.zerohedge.com/market-recaps/sp-futures-trade-all-time-high-boosted-trade-talks-nike-results,zerohedge.com,2025-06-27T12:28:12.000000Z,"UNB, YI, AUB.AX, ^AXJO, AAPL, LI, GOOGL, AUB, AUBAP, BIDU, NVDA, MSFT, COWN, COWNL, TSLA, ^N225, USDJPY, EURUSD, ^FCHI","Financial Services, Healthcare, Technology, Consumer Cyclical, Communication Services"
56dabed8-dd34-4492-93c6-e745985f6420,"Asian shares mostly higher after US stocks rise to brink of record — Investors monitor US-China trade deal, market performance, and tariff impact on economy and inflation.",,https://www.thehindubusinessline.com/markets/asian-shares-mostly-higher-after-us-stocks-rise-to-brink-of-record/article69743651.ece,thehindubusinessline.com,2025-06-27T07:09:57.000000Z,"^HSI, NVDA, SMCI, ^KS11, ^N225",Technology
1e628161-ba30-4f17-adce-4a606244e860,Cyngn (CYN) Skyrockets Nearly 500%--Thanks to Nvidia's Backing — June 26 - Cyngn (CYN) shares soared as much as 500% Thursday morning after the industrial automation company revealed a partnership with Nvidia (NVDA) to featur,,https://www.gurufocus.com/news/2948412/cyngn-cyn-skyrockets-nearly-500thanks-to-nvidias-backing,gurufocus.com,2025-06-26T22:47:05.000000Z,NVDA,Technology
